,title,director,cast,country,release_year,rating,budget,revenue,runtime,movie_id,genre,streaming
281,X-Men: Days of Future Past,Bryan Singer,"Hugh Jackman, James McAvoy, Michael Fassbender, Jennifer Lawrence, Halle Berry, Nicholas Hoult","United States, United Kingdom, Canada",2014,PG-13,250000000.0,747862775.0,132.0,127585.0,"Action,Adventure,Science Fiction,",Disney+
282,The Undefeated Presents: Hamilton In-Depth,,"Lin-Manuel Miranda, Thomas Kail, Renee Goldsberry, Leslie Odom Jr., Daveed Diggs, Phillipa Soo",United States,2020,TV-PG,0.0,0.0,33.0,726430.0,"Documentary,",Disney+
283,Diary of a Wimpy Kid: Rodrick Rules,David Bowers,"Zachary Gordon, Devon Bostick, Rachael Harris, Robert Capron, Steve Zahn",United States,2011,PG,0.0,0.0,74.0,897192.0,"Animation,Comedy,Family,",Disney+
284,Hamilton,Thomas Kail,"Daveed Diggs, Renée Goldsberry, Jonathan Groff, Christopher Jackson, Jasmine Jones, Lin-Manuel Miranda",United States,2020,PG-13,0.0,0.0,160.0,556574.0,"History,Drama,",Disney+
285,Ice Age: Collision Course,Mike Thurmeier,"Ray Romano, John Leguizamo, Denis Leary, Adam Devine, Jesse Ferguson, Max Greenfield","United States, United Kingdom, Australia",2016,PG,105000000.0,408579038.0,95.0,278154.0,"Adventure,Animation,Family,Comedy,Science Fiction,",Disney+
286,Race to Witch Mountain,Andy Fickman,"Dwayne Johnson, AnnaSophia Robb, Carla Gugino, Ciarán Hinds, Alexander Ludwig, Tom Scott",United States,2009,PG,50000000.0,106303988.0,98.0,13836.0,"Adventure,Family,Fantasy,Science Fiction,Thriller,Action,",Disney+
287,The Big Green,Holly Sloan,"Steve Guttenberg, Olivia d'Abo, Jay Sanders, John Terry, Chauncey Leopardi, Patrick Renna",United States,1995,PG,0.0,0.0,100.0,26441.0,"Action,Adventure,Comedy,Family,",Disney+
288,The Mighty Ducks,Stephen Herek,"Emilio Estevez, Joss Ackland, Lane Smith, Heidi Kling, Josef Sommer, Joshua Jackson",United States,1992,PG,0.0,45610410.0,106.0,11164.0,"Comedy,Action,Family,Drama,",Disney+
289,While You Were Sleeping,Jon Turteltaub,"Sandra Bullock, Bill Pullman, Peter Gallagher, Peter Boyle, Glynis Johns, Micole Mercurio",United States,1995,PG,17000000.0,182057016.0,103.0,2064.0,"Romance,Comedy,",Disney+
290,Man in Space,Ward Kimball,"Walt Disney, Dick Tufeld, Ward Kimball, Willy Ley, Dr. Heinz Haber, Dr. Wernher von Braun",United States,1955,TV-PG,0.0,0.0,49.0,205188.0,"Science Fiction,Documentary,",Disney+
291,Mars and Beyond,Ward Kimball,"Walt Disney, Paul Frees, Dr. Ernst Stuhlinger, Dr. Wernher von Braun, Dr. E.C. Slipher",United States,1957,TV-G,0.0,0.0,55.0,725864.0,,Disney+
292,Marvel Studios' Avengers: Infinity War,"Anthony Russo, Joe Russo","Robert Downey Jr., Chris Hemsworth, Mark Ruffalo, Chris Evans, Scarlett Johansson, Don Cheadle",United States,2018,PG-13,300000000.0,2046239637.0,149.0,299536.0,"Adventure,Action,Science Fiction,",Disney+
293,Tarzan,"Kevin Lima, Chris Buck","Tony Goldwyn, Minnie Driver, Glenn Close, Alex Linz, Rosie O'Donnell, Brian Blessed",United States,1999,G,130000000.0,448191819.0,88.0,37135.0,"Family,Adventure,Animation,Drama,",Disney+
294,Tarzan II,Brian Smith,"Harrison Chad, George Carlin, Brad Garrett, Ron Perlman, Estelle Harris, Glenn Close",United States,2005,G,0.0,0.0,72.0,15657.0,"Adventure,Animation,Family,",Disney+
295,Big Sur: Wild California,,Hector Elizondo,United States,2010,TV-PG,0.0,0.0,47.0,71923.0,"Documentary,",Disney+
296,Egypt's Treasure Guardians,"Ben Allen, Tom Jenner",Dominic Frisby,United Kingdom,2016,TV-PG,0.0,0.0,0.0,432246.0,,Disney+
297,The Jungle Book,Jon Favreau,"Bill Murray, Ben Kingsley, Idris Elba, Lupita Nyong'o, Scarlett Johansson, Giancarlo Esposito","United Kingdom, United States",2016,PG,4000000.0,205843612.0,78.0,9325.0,"Family,Animation,Adventure,",Disney+
298,The Pirate Fairy,Peggy Holmes,"Mae Whitman, Christina Hendricks, Tom Hiddleston, Lucy Liu, Raven-Symoné , Megan Hilty",United States,2014,G,0.0,20300000.0,78.0,175112.0,"Animation,Family,",Disney+
299,Trail Mix-Up,Barry Cook,"Charles Fleischer, Kathleen Turner, April Winchell, Lou Hirsch, Corey Burton, Frank Welker",United States,1993,TV-G,0.0,0.0,8.0,83203.0,"Comedy,Animation,",Disney+
300,Tummy Trouble,"Frank Marshall, Rob Minkoff","Charles Fleischer, April Winchell, Lou Hirsch, Corey Burton, Richard Williams, Kathleen Turner",United States,1989,TV-G,0.0,0.0,7.0,83200.0,"Comedy,Animation,",Disney+
301,Artemis Fowl,Kenneth Branagh,,United States,2020,PG,125000000.0,0.0,94.0,475430.0,"Adventure,Fantasy,Science Fiction,Family,Action,",Disney+
302,The Liberty Story,"Hamilton Luske, Robert Stevenson",Walt Disney,United States,1957,TV-PG,0.0,0.0,48.0,707260.0,"Adventure,Drama,Family,",Disney+
303,The Story of the Animated Drawing,"Wilfred Jackson, William Beaudine",,United States,1955,TV-PG,0.0,0.0,49.0,709647.0,"Documentary,",Disney+
304,Walt & El Grupo,Theodore Thomas,,United States,2009,PG,0.0,0.0,120.0,278247.0,"Drama,",Disney+
305,America's Greatest Animals,,"Bray Poor, Casey Anderson, Brady Barr, Andy Casagrande, Mireya Mayor",United States,2012,TV-PG,0.0,0.0,96.0,709660.0,"Documentary,",Disney+
306,Chasing the Equinox,Kenny Scott,Stefan Frank,,2019,TV-PG,0.0,0.0,45.0,711564.0,"Documentary,",Disney+
307,Percy Jackson & The Olympians: The Lightning Thief,Chris Columbus,"Logan Lerman, Brandon T. Jackson, Alexandra Daddario, Sean Bean, Pierce Brosnan, Steve Coogan","United Kingdom, Canada, United States",2010,PG,95000000.0,226497209.0,118.0,32657.0,"Adventure,Fantasy,Family,",Disney+
308,Women Of Impact: Changing The World,,Julianna Margulies,United States,2019,TV-PG,0.0,0.0,0.0,669441.0,"Documentary,",Disney+
309,"Maggie Simpson in ""The Longest Daycare""",,,United States,2012,PG,0.0,0.0,5.0,116440.0,"Animation,Drama,Family,",Disney+
310,Mickey and the Seal,Charles Nichols,,United States,1948,TV-G,0.0,0.0,7.0,67001.0,"Animation,Comedy,Family,",Disney+
311,The Moon-Spinners,James Neilson,"Hayley Mills, Joan Greenwood, Michael Davis, Irene Papas, Paul Stassino, Eli Wallach",United States,1964,PG,0.0,0.0,118.0,42795.0,"Mystery,Family,Thriller,Romance,",Disney+
312,Fantastic Mr. Fox,Wes Anderson,"George Clooney, Meryl Streep, Jason Schwartzman, Bill Murray, Wally Wolodarsky, Eric Anderson","United States, United Kingdom",2009,PG,40000000.0,46471023.0,87.0,10315.0,"Adventure,Animation,Comedy,Family,",Disney+
313,"Hello, Dolly!",Gene Kelly,"Barbara Streisand, Walter Matthau, Michael Crawford, Marianne McAndrew, Danny Lockin, E.J. Peaker",United States,1969,G,24000000.0,33208099.0,146.0,14030.0,"Comedy,Romance,Music,",Disney+
314,Out,Steven Hunter,"Bernadette Sullivan, Kyle McDaniel, Caleb Cabrera, Matthew Martin",United States,2020,PG,175000000.0,857611174.0,95.0,150540.0,"Animation,Family,Adventure,Drama,Comedy,",Disney+
315,The Boys: The Sherman Brothers' Story,"Jeffrey Sherman, Gregory Sherman",,United States,2009,PG,0.0,0.0,101.0,64831.0,"Documentary,Music,",Disney+
316,Maleficent: Mistress of Evil,Joachim Rønning,"Angelina Jolie, Elle Fanning, Chiwetel Ejiofor, Sam Riley, Harris Dickinson, Ed Skrein","United States, United Kingdom, Canada",2019,PG,185000000.0,491730089.0,119.0,420809.0,"Family,Fantasy,Adventure,Action,",Disney+
317,Star Wars: The Rise of Skywalker (Episode IX),J.J. Abrams,"Carrie Fisher, Mark Hamill, Adam Driver, Daisy Ridley, John Boyega, Oscar Isaac",United States,2019,PG-13,250000000.0,1074144248.0,142.0,181812.0,"Adventure,Action,Science Fiction,",Disney+
318,John Carter,Andrew Stanton,"Taylor Kitsch, Lynn Collins, Samantha Morton, Mark Strong, Ciarán Hinds, Dominic West",United States,2012,PG-13,250000000.0,284139100.0,132.0,49529.0,"Action,Adventure,Science Fiction,",Disney+
319,Bride of Boogedy,Oz Scott,"Richard Masur, Mimi Kennedy, Tammy Lauren, David Faustino, Joshua Rudoy, Leonard Frey",United States,1987,TV-PG,0.0,0.0,90.0,47631.0,"Horror,Family,Comedy,TV Movie,",Disney+
320,George of the Jungle,Sam Weisman,"Brendan Fraser, Leslie Mann, Thomas Church, Richard Roundtree, Greg Cruttwell, Abraham Benrubi",United States,1997,PG,55000000.0,174463257.0,93.0,10603.0,"Adventure,Comedy,Family,Romance,",Disney+
321,Homeward Bound II: Lost in San Francisco,David Ellis,"Robert Hays, Kim Greist, Veronica Lauren, Kevin Chevalia, Benj Thall, Max Perlich",United States,1996,G,0.0,32709423.0,89.0,25059.0,"Adventure,Comedy,Drama,Family,",Disney+
322,Homeward Bound: The Incredible Journey,Duwayne Dunham,"Robert Hays, Kim Greist, Jean Smart, Veronica Lauren, Kevin Chevalia, Benj Thall",United States,1993,G,0.0,0.0,84.0,6878.0,"Adventure,Comedy,Drama,Family,",Disney+
323,How to Play Baseball,Jack Kinney,,United States,1942,TV-G,0.0,0.0,8.0,66983.0,"Comedy,Animation,",Disney+
324,In Beaver Valley,James Algar,Winston Hibler,United States,1950,TV-PG,0.0,0.0,32.0,162352.0,"Documentary,",Disney+
325,Nature's Half Acre,James Algar,Winston Hibler,United States,1951,TV-PG,0.0,0.0,33.0,179182.0,"Documentary,",Disney+
326,Prowlers of the Everglades,James Algar,,United States,1953,TV-Y7,0.0,0.0,32.0,179185.0,"Documentary,",Disney+
327,The Princess Bride,Rob Reiner,"Cary Elwes, Mandy Patinkin, Chris Sarandon, Christopher Guest, Wallace Shawn, Andre the Giant","United Kingdom, United States",1987,PG,16000000.0,30861665.0,99.0,2493.0,"Adventure,Family,Fantasy,Comedy,Romance,",Disney+
328,Water Birds,Ben Sharpsteen,Winston Hibler,United States,1952,TV-G,0.0,0.0,30.0,179184.0,"Documentary,Family,",Disney+
329,National Treasure,Jon Turteltaub,"Nicolas Cage, Jon Voight, Harvey Keitel, Diane Kruger, Sean Bean, Justin Bartha",United States,2004,PG,100000000.0,347512318.0,131.0,2059.0,"Adventure,Action,Thriller,Mystery,",Disney+
330,Born Wild: The Next Generation,Liliana Olszewski,Robin Roberts,United States,2020,TV-PG,0.0,0.0,60.0,687290.0,"Documentary,",Disney+
331,The Olympic Elk,James Algar,Winston Hibler,United States,1952,TV-G,0.0,0.0,27.0,179183.0,"Documentary,",Disney+
332,Jane Goodall: The Hope,"Elizabeth Leiter, Kimberly Woodard",Jane Goodall,United States,2020,TV-14,0.0,0.0,88.0,694059.0,"Documentary,Adventure,",Disney+
333,Let's Stick Together,Jack Hannah,,United States,1952,TV-G,0.0,0.0,7.0,66989.0,"Animation,",Disney+
334,Pluto's Purchase,Charles Nichols,"Pinto Colvig, James MacDonald",United States,1948,TV-G,0.0,0.0,7.0,164976.0,"Animation,",Disney+
335,A Celebration of the Music from Coco,Ron de Moraes,"Benjamin Bratt, Eva Longoria, Carlos Rivera, Natalia Jiménez, Alanna Ubach, Jaime Camil",United States,2020,TV-PG,0.0,0.0,47.0,691582.0,"Music,Documentary,",Disney+
336,"Maggie Simpson in ""Playdate with Destiny""",David Silverman,,United States,2020,G,0.0,0.0,4.0,673595.0,"Animation,Comedy,Family,Romance,",Disney+
337,A Tale of Two Critters,Jack Speirs,Mayf Nutter,United States,1977,G,0.0,0.0,48.0,290164.0,"Adventure,Family,Documentary,",Disney+
338,All in a Nutshell,Jack Hannah,,United States,1949,TV-G,0.0,0.0,7.0,49077.0,"Animation,",Disney+
339,Disneynature Penguins,"Alastair Fothergill, Jeff Wilson",Ed Helms,United States,2019,G,,,,,,Disney+
340,Diving with Dolphins,Keith Scholey,Celine Cousteau,United States,2020,G,0.0,0.0,79.0,689242.0,"Documentary,",Disney+
341,Dolphin Reef,Keith Scholey,Natalie Portman,United States,2018,G,0.0,0.0,76.0,454291.0,"Documentary,Family,",Disney+
342,Don's Fountain of Youth,Jack Hannah,,United States,1953,TV-G,0.0,0.0,6.0,55503.0,"Animation,",Disney+
343,Donald's Dog Laundry,Jack King,,United States,1940,TV-G,0.0,0.0,8.0,55362.0,"Animation,",Disney+
344,Double Dribble,Jack Hannah,,United States,1946,TV-G,0.0,0.0,7.0,66850.0,"Animation,",Disney+
345,Dragon Around,Jack Hannah,,United States,1954,TV-G,0.0,0.0,7.0,55510.0,"Animation,Family,",Disney+
346,Elephant,Mark Linfield,"Meghan,  The Duchess of Sussex",United States,2020,G,0.0,0.0,93.0,843633.0,"Action,Crime,Thriller,",Disney+
347,Elmer Elephant,Wilfred Jaxon,"Jeanie Roberts, Pinto Colvig, Hal Rees, Leone Ledoux, Carlisle Tupper, Gay Seabrook",United States,1936,TV-G,0.0,0.0,8.0,52482.0,"Animation,",Disney+
348,How To Play Football,Jack Kinney,Pinto Colvig,United States,1944,TV-G,0.0,0.0,7.0,66984.0,"Animation,",Disney+
349,In the Footsteps of Elephant,Vanessa Berlowitz,Jeremy Sisto,United States,2020,G,0.0,0.0,88.0,689243.0,"Documentary,",Disney+
350,"Lambert, The Sheepish Lion",Jack Hannah,Sterling Holloway,United States,1952,TV-G,0.0,0.0,8.0,54184.0,"Animation,",Disney+
351,On Ice,Ben Sharpsteen,"Pinto Colvig, Walt Disney, Marcellite Garner",United States,1935,TV-G,0.0,0.0,8.0,67152.0,"Animation,",Disney+
352,Onward,Dan Scanlon,"Tom Holland, Chris Pratt, Julia Louis-Dreyfus, Octavia Spencer, Mel Rodriguez, Kyle Bornheimer",United States,2020,PG,200000000.0,141592359.0,103.0,508439.0,"Family,Animation,Adventure,Comedy,Fantasy,",Disney+
353,Out of Scale,Jack Hannah,,United States,1951,TV-G,0.0,0.0,7.0,67158.0,"Animation,Family,",Disney+
354,Penguins: Life on the Edge,"Alastair Fothergill, Jeff Wilson",Blair Underwood,United States,2020,G,0.0,0.0,78.0,689244.0,"Documentary,",Disney+
355,Pluto's Party,Milt Schaffer,"Jimmy MacDonald, Pinto Colvig",United States,1952,TV-G,0.0,0.0,7.0,67163.0,"Animation,",Disney+
356,Sea Scouts,Dick Lundy,,United States,1939,TV-PG,0.0,0.0,8.0,78485.0,"Animation,",Disney+
357,The Boy Who Talked to Badgers,Gary Nelson,"Carl Betz, Salome Jens, Christian Juttner, Robert Donner, Denver Pyle, Stuart Lee",United States,1975,TV-PG,0.0,0.0,100.0,400400.0,"Family,Adventure,TV Movie,",Disney+
358,The New Neighbor,Jack Hannah,,United States,1953,TV-G,0.0,0.0,7.0,67593.0,"Animation,",Disney+
359,The Small One,Don Bluth,"Sean Marshall, William Woodson, Olan Soulé, Joe Higgins, Gordon Jump, Hal Smith",United States,1978,TV-PG,0.0,0.0,26.0,27287.0,"Animation,Family,",Disney+
360,The Straight Story,David Lynch,"Richard Farnsworth, Sissy Spacek, Harry Stanton, Everett McGill, John Farley, Kevin Farley","France, United Kingdom, United States",1999,G,10000000.0,6203044.0,112.0,404.0,"Drama,",Disney+
361,Frankenweenie,Tim Burton,"Catherine O'Hara, Martin Short, Martin Landau, Charlie Tahan, Atticus Shaffer, Winona Ryder",United States,2012,PG,39000000.0,81493846.0,87.0,62214.0,"Animation,Comedy,Family,",Disney+
362,Mars Needs Moms,Simon Wells,"Seth Green, Dan Fogler, Elizabeth Harnois, Mindy Sterling, Kevin Cahoon, Joan Cusack",United States,2011,PG,150000000.0,38992758.0,88.0,50321.0,"Adventure,Animation,Family,",Disney+
363,Prom,Joe Nussbaum,"Aimee Teegarden, Thomas McDonell, De'Vaughn Nixon, Danielle Campbell, Yin Chang, Jared Kusnitz",United States,2011,PG,8000000.0,10130000.0,104.0,51588.0,"Comedy,Romance,",Disney+
364,The Last Song,Julie Robinson,"Miley Cyrus, Liam Hemsworth, Bobby Coleman, Nick Searcy, Kelly Preston, Greg Kinnear",United States,2010,PG,20000000.0,89137047.0,107.0,35690.0,"Drama,Family,Romance,",Disney+
365,The Odd Life of Timothy Green,Peter Hedges,"Jennifer Garner, Joel Edgerton, Dianne Wiest, CJ Adams, Rosemarie DeWitt, Ron Livingston",United States,2012,PG,25000000.0,56012642.0,105.0,71864.0,"Fantasy,Drama,Comedy,Family,",Disney+
366,A Wrinkle in Time,Ava DuVernay,"Oprah Winfrey, Reese Witherspoon, Mindy Kaling, Storm Reid, Levi Miller, Deric McCabe",United States,2018,PG,103000000.0,132675864.0,109.0,407451.0,"Adventure,Science Fiction,Family,Fantasy,",Disney+
367,G-Force,Hoyt Yeatman IV,"Bill Nighy, Will Arnett, Zach Galifianakis, Kelli Garner, Tyler Jones, Jack Conley",United States,2009,PG,150000000.0,292817841.0,88.0,19585.0,"Animation,Family,Fantasy,Action,Adventure,Comedy,",Disney+
368,Frozen 2,"Chris Buck, Jennifer Lee","Kristen Bell, Idina Menzel, Josh Gad, Jonathan Groff, Sterling Brown, Evan Wood",United States,2019,PG,0.0,0.0,71.0,490935.0,"Animation,Music,Family,",Disney+
369,Stargirl,Julia Hart,"Grace VanderWaal, Graham Verchere, Giancarlo Esposito, Karan Brar, Darby Stanchfield, Maximiliano Hernandez",United States,2020,PG,0.0,0.0,107.0,382748.0,"Comedy,Drama,Romance,Family,",Disney+
370,The Finest Hours,Craig Gillespie,"Chris Pine, Casey Affleck, Ben Foster, Holliday Grainger, John Ortiz, Kyle Gallner",United States,2016,PG-13,80000000.0,52099090.0,117.0,300673.0,"Action,Drama,History,Thriller,",Disney+
371,The Sandlot: Heading Home,William Dear,"Danny Nucci, Luke Perry, Keanu Pires, Sarah Deakins, Chauncey Leopardi, Brandon Olds","United States, Canada",2007,PG,0.0,0.0,96.0,21138.0,"Family,",Disney+
372,Bedtime Stories,Adam Shankman,"Adam Sandler, Keri Russell, Guy Pearce, Russell Brand, Richard Griffiths, Jonathan Pryce",United States,2008,PG,80000000.0,212874864.0,99.0,10202.0,"Fantasy,Comedy,Family,Romance,",Disney+
373,Marvel Studios' Black Panther,Ryan Coogler,"Chadwick Boseman, Michael Jordan, Lupita Nyong'o, Danai Gurira, Martin Freeman, Daniel Kaluuya",United States,2018,PG-13,200000000.0,1347597973.0,135.0,284054.0,"Action,Adventure,Science Fiction,",Disney+
374,Disney Phineas and Ferb: Phineas and Ferb Star Wars,,"Vincent Martella, Ashley Tisdale, Thomas Brodie-Sangster, Caroline Rhea, Richard O'Brien, Dan Povenmire",United States,2014,TV-G,,,,,,Disney+
375,Viking Warrior Women,Stuart Strickson,Ella Al-Shamahi,United Kingdom,2019,TV-PG,0.0,0.0,44.0,691115.0,"Documentary,History,TV Movie,",Disney+
376,Marvel Rising: Operation Shuri,Chris Rutkowski,"Dee Baker, Dove Cameron, Jessica DiCicco, Skai Jackson, Kathreen Khavari, Daisy Lightfoot",United States,2019,TV-Y7,0.0,0.0,22.0,592688.0,"Family,Animation,Science Fiction,Adventure,",Disney+
377,Marvel Rising: Playing With Fire,Sol Choi,"Dee Baker, Dove Cameron, Gary Cole, Kathreen Khavari, Meera Kumbhani, Tony Mirrcandani",United States,2019,TV-Y7,0.0,0.0,44.0,592689.0,"Animation,Action,Adventure,Family,",Disney+
378,Marvel's Iron Man & Hulk: Heroes United,Leo Riley,"Adrian Pasdar, Fred Tatasciore, David Kaye, Dee Baker, Robin Downes",United States,2013,PG,200000000.0,1214811252.0,130.0,68721.0,"Action,Adventure,Science Fiction,",Disney+
379,Because of Winn-Dixie,Wayne Wang,"Jeff Daniels, Cicely Tyson, Dave Matthews, Eva Saint, AnnaSophia Robb",United States,2005,PG,14000000.0,32645546.0,106.0,17880.0,"Family,Comedy,Drama,",Disney+
380,"My Dog, the Thief",Robert Stevenson,"Dwayne Hickman, Mary Mobley, Elsa Lanchester, Joe Flynn, Roger Carmel, Mickey Shaughnessy",United States,1969,TV-PG,0.0,0.0,88.0,64277.0,"Family,Comedy,TV Movie,",Disney+
381,Splash,Ron Howard,"Tom Hanks, Daryl Hannah, Eugene Levy, John Candy, Dody Goodman, Shecky Greene",United States,1984,TV-PG,8000000.0,69821334.0,111.0,2619.0,"Comedy,Fantasy,Romance,",Disney+
382,Timmy Failure: Mistakes Were Made,Tom McCarthy,"Winslow Fegley, Ophelia Lovibond, Craig Robinson, Wallace Shawn, Kyle Bornheimer, Chloe Coleman",United States,2020,PG,45000000.0,0.0,99.0,550440.0,"Family,Mystery,Comedy,Fantasy,",Disney+
383,Toy Story 4,Josh Cooley,"Tom Hanks, Tim Allen, Annie Potts, Tony Hale, Keegan-Michael Key, Madeleine McGraw",United States,2019,G,175000000.0,1073394593.0,100.0,301528.0,"Family,Adventure,Animation,Comedy,Fantasy,",Disney+
384,Descendants 3,Kenny Ortega,"Dove Cameron, Cameron Boyce, Sofia Carson, Booboo Stewart, Mitchell Hope, Sarah Jefferey",United States,2019,TV-G,15000000.0,0.0,106.0,506574.0,"Family,TV Movie,Music,Adventure,Fantasy,",Disney+
385,Around the World in 80 Days,Frank Coraci,"Jackie Chan, Steve Coogan, Cécile de France, Jim Broadbent, Ewan Bremner, Ian McNeice","United States, Germany, Ireland, United Kingdom",2004,PG,110000000.0,72178895.0,120.0,10204.0,"Action,Adventure,Comedy,",Disney+
386,Big Business,Jim Abrahams,"Bette Midler, Lily Tomlin, Fred Ward, Edward Herrmann, Michele Placido, Daniel Gerroll",United States,1988,PG,0.0,0.0,97.0,12710.0,"Comedy,",Disney+
387,Lamp Life,Valerie LaPointe,"Annie Potts, Jim Hanks, Ally Maki, Emily Davis",United States,2020,TV-G,0.0,0.0,7.0,594530.0,"Animation,Comedy,Family,",Disney+
388,The Lion King,Jon Favreau,"Donald Glover, Seth Rogen, Chiwetel Ejiofor, Alfre Woodard, Billy Eichner, John Kani","United States, United Kingdom, South Africa",2019,PG,45000000.0,763455561.0,89.0,8587.0,"Family,Animation,Drama,",Disney+
389,Destino,Monfery Dominique,Dora Luz,"France, United States",2003,PG,5308245.0,3468053.0,89.0,800823.0,"Comedy,Family,",Disney+
390,Forky Asks a Question: What is Reading?,Bob Peterson,"Tony Hale, Addison Andrews, Mila Crespo, Imani Prior, Jeff Pidgeon, Bob Peterson",United States,2020,TV-G,0.0,0.0,4.0,662666.0,"Animation,Family,Comedy,",Disney+
391,Loop,Erica Milsom,"Madison Bandy, Christiano Delgado, Louis Gonzales, Asher Brodkey, Erica Milsom",United States,2020,PG,0.0,0.0,10.0,574089.0,"Animation,Family,",Disney+
392,Aladdin (2019),Guy Ritchie,"Will Smith, Mena Massoud, Naomi Scott, Marwan Kenzari, Navid Negahban, Nasim Pedrad",United States,2019,PG,,,,,,Disney+
393,Forky Asks a Question: What is Cheese?,Bob Peterson,"Tony Hale, Jeff Garlin, Bob Peterson",United States,2020,TV-G,0.0,0.0,3.0,660867.0,"Animation,Family,Comedy,",Disney+
394,Cars Toon: El Materdor,John Lasseter,"Larry the Cable Guy , Keith Ferguson",United States,2008,TV-G,0.0,0.0,3.0,39030.0,"Animation,",Disney+
395,Cars Toon: Moon Mater,Rob Gibbs,"Larry the Cable Guy , Keith Ferguson, Josh Cooley",United States,2010,TV-G,0.0,0.0,4.0,148608.0,"Animation,Comedy,",Disney+
396,Cars Toon: Rescue Squad Mater,John Lasseter,"Larry the Cable Guy , Keith Ferguson, Bret Parker, Peter Sohn, Bob Peterson, Bob Scott",United States,2010,TV-Y7,0.0,0.0,3.0,56553.0,"Animation,Family,Comedy,",Disney+
397,Cars Toon: Spinning,Jeremy Lasky,"Keith Ferguson, Paul Dooley, Tony Shalhoub, Lloyd Sherr, Michael Wallis, Guido Quaroni",United States,2013,TV-G,,,,,,Disney+
398,Cars Toon: Time Travel Mater,Rob Gibbs,"Larry the Cable Guy , Keith Ferguson, John Higgins, Katherine Helmond",United States,2012,TV-G,,,,,,Disney+
399,Cars Toon: Tokyo Mater,John Lasseter,"Larry the Cable Guy , Keith Ferguson, Michael Wallis, Mach Kobayashi, Robert Ito",United States,2008,G,,,,,,Disney+
400,Cars Toon: Unidentified Flying Mater,John Lasseter,"Larry the Cable Guy , Keith Ferguson",United States,2010,TV-Y7,0.0,0.0,4.0,171536.0,"Animation,Comedy,Family,Adventure,",Disney+
401,Cars Toons: Bugged,Jeremy Lasky,"Jerome Ranft, Josh Cooley",United States,2013,TV-G,,,,,,Disney+
402,Cool Runnings,Jon Turteltaub,"Leon , Doug Doug, Rawle Lewis, Malik Yoba, Raymond Barry, Larry Gilman",United States,1993,PG,14000000.0,154856263.0,98.0,864.0,"Comedy,Adventure,Drama,",Disney+
403,Drain Alcatraz,Wayne Abbott,"Craig Sechler, Russell Boulter",United States,2017,TV-PG,0.0,0.0,45.0,537287.0,"Documentary,",Disney+
404,Drain The Bermuda Triangle,Jobim Sampson,Russell Boulter,United States,2014,TV-PG,2000000.0,4000000.0,50.0,423431.0,"Documentary,",Disney+
405,Drain The Great Lakes,"Crispin Sadler, Wayne Abbott",Cham Giobbi,"United Kingdom, Canada, United States",2011,TV-PG,0.0,0.0,60.0,215147.0,"Documentary,",Disney+
406,Drain The Ocean: WWII,Mike Slee,Russell Boulter,United States,2016,TV-PG,0.0,0.0,45.0,428843.0,"Documentary,",Disney+
407,Drain The Sunken Pirate City,Sophie Harris,Russell Boulter,United Kingdom,2017,TV-14,0.0,0.0,47.0,587026.0,"Documentary,History,",Disney+
408,Drain The Titanic,Jobim Sampson,Russell Boulter,"United Kingdom, Canada, United States",2015,TV-PG,0.0,0.0,46.0,428950.0,"Documentary,",Disney+
409,Hacksaw,Larry Lansburgh,"Tab Hunter, Victor Millan, Ray Teal, Russ McCubbin, George Barrows, Christine Austin",United States,1971,TV-PG,40000000.0,175302354.0,139.0,324786.0,"Drama,History,War,",Disney+
410,Holes,Andrew Davis,"Sigourney Weaver, Jon Voight, Patricia Arquette, Tim Nelson, Dulé Hill, Shia LaBeouf",United States,2003,PG,20000000.0,71406573.0,117.0,8326.0,"Adventure,Family,Drama,Comedy,",Disney+
411,Marvel 75 Years: From Pulp to Pop!,Zak Knutson,"Laura Shields, Stan Lee, Alan Fine, Nicole Perlman, Jimmy Kimmel, Gerry Conway",United States,2014,TV-PG,0.0,0.0,41.0,299969.0,"Documentary,",Disney+
412,Marvel Rising: Battle of The Bands,,"Dee Baker, Dove Cameron, Skai Jackson, Kathreen Khavari, Kamil McFadden, Tyler Posey",United States,2019,TV-Y7,0.0,0.0,22.0,592687.0,"Family,Animation,Action,Comedy,Science Fiction,",Disney+
413,Super Rhino,Nathan Greno,"Miley Cyrus, Mark Walton, Susie Essman, Malcolm McDowell, Randy Savage",United States,2009,G,0.0,0.0,5.0,16604.0,"Animation,Comedy,",Disney+
414,Forky Asks a Question: What is a Pet?,Bob Peterson,"Tony Hale, Aloma Wright, Bob Peterson",United States,2019,TV-G,0.0,0.0,4.0,660866.0,"Animation,Family,Comedy,",Disney+
415,Star Wars: The Last Jedi (Episode VIII),Rian Johnson,"Mark Hamill, Carrie Fisher, Adam Driver, Daisy Ridley, John Boyega, Oscar Isaac",United States,2017,PG-13,200000000.0,1332698830.0,152.0,181808.0,"Adventure,Action,Science Fiction,",Disney+
416,Forky Asks a Question: What is a Leader?,Bob Peterson,"Tony Hale, Bonnie Hunt, Bob Peterson",United States,2019,TV-G,0.0,0.0,3.0,660862.0,"Animation,Family,Comedy,",Disney+
417,George of the Jungle 2,David Grossman,"Thomas Church, Julie Benz, Christina Pickles, Angus Jones, Kelly Miller, John Kassir","United States, Australia",2003,PG,12000000.0,0.0,87.0,26264.0,"Adventure,Comedy,Family,",Disney+
418,High School Musical: The Musical: The Series: The Special,Clayton Cogswell,"Joshua Bassett, Olivia Rodrigo, Sofia Wylie, Matt Cornett, Dara Renee",United States,2019,TV-G,0.0,0.0,23.0,658938.0,"Documentary,Music,",Disney+
419,Togo,Ericson Core,"Willem Dafoe, Julianne Nicholson, Christopher Heyerdahl, Richard Dormer, Michael Greyeyes, Michael McElhatton",United States,2019,PG,0.0,0.0,95.0,884363.0,"Crime,Drama,",Disney+
420,Forky Asks a Question: What is a Computer?,Bob Peterson,"Tony Hale, Kristen Schaal, James Brinkley, Bob Peterson",United States,2019,TV-G,0.0,0.0,3.0,660861.0,"Animation,Family,Comedy,",Disney+
421,Wind,Edwin Chang,"Emilio Fuentes, Sonoko Konishi",United States,2019,G,0.0,0.0,123.0,1033107.0,"Crime,Drama,",Disney+
422,Forky Asks a Question: What is Love?,Bob Peterson,"Tony Hale, Carl Reiner, Mel Brooks, Carol Burnett, Betty White, Kristen Schaal",United States,2019,TV-G,0.0,0.0,4.0,660859.0,"Animation,Family,Comedy,",Disney+
