,title,director,cast,country,release_year,rating,budget,revenue,runtime,movie_id,genre,streaming
699,Marvel Studios' Captain America: The Winter Soldier,"Anthony Russo, Joe Russo","Chris Evans, Scarlett Johansson, Sebastian Stan, Anthony Mackie, Cobie Smulders, Frank Grillo",United States,2014,PG-13,170000000.0,714766572.0,136.0,100402.0,"Action,Adventure,Science Fiction,",Disney+
700,Marvel Studios' Captain Marvel,"Anna Boden, Ryan Fleck","Brie Larson, Samuel Jackson, Ben Mendelsohn, Djimon Hounsou, Lee Pace, Lashana Lynch","United States, Australia",2019,PG-13,152000000.0,1128276090.0,124.0,299537.0,"Action,Adventure,Science Fiction,",Disney+
701,Marvel Studios' Doctor Strange,Scott Derrickson,"Benedict Cumberbatch, Chiwetel Ejiofor, Rachel McAdams, Benedict Wong, Michael Stuhlbarg, Benjamin Bratt",United States,2016,PG-13,165000000.0,677796076.0,115.0,284052.0,"Action,Adventure,Fantasy,",Disney+
702,Marvel Studios' Guardians of the Galaxy,James Gunn,"Chris Pratt, Zoë Saldana, Dave Bautista, Vin Diesel, Bradley Cooper, Lee Pace",United States,2014,PG-13,170000000.0,772776600.0,121.0,118340.0,"Action,Science Fiction,Adventure,",Disney+
703,Marvel Studios' Guardians of the Galaxy Vol. 2,James Gunn,"Chris Pratt, Bradley Cooper, Vin Diesel, Pom Klementieff, Zoë Saldana, Dave Bautista",United States,2017,PG-13,200000000.0,863756051.0,137.0,283995.0,"Adventure,Action,Science Fiction,",Disney+
704,Marvel Studios' Iron Man,Jon Favreau,"Robert Downey Jr., Terrence Howard, Jeff Bridges, Gwyneth Paltrow, Leslie Bibb, Shaun Toub","United States, Canada",2008,PG-13,200000000.0,623933331.0,124.0,10138.0,"Adventure,Action,Science Fiction,",Disney+
705,Marvel Studios' Iron Man 2,Jon Favreau,"Robert Downey Jr., Gwyneth Paltrow, Don Cheadle, Scarlett Johansson, Sam Rockwell, Clark Gregg",United States,2010,PG-13,200000000.0,623933331.0,124.0,10138.0,"Adventure,Action,Science Fiction,",Disney+
706,Marvel Studios' Iron Man 3,Shane Black,"Robert Downey Jr., Gwyneth Paltrow, Don Cheadle, Guy Pearce, Rebecca Hall, Stephanie Szostak",United States,2013,PG-13,200000000.0,1214811252.0,130.0,68721.0,"Action,Adventure,Science Fiction,",Disney+
707,Marvel Studios' The Avengers,Joss Whedon,"Robert Downey Jr., Chris Evans, Mark Ruffalo, Chris Hemsworth, Scarlett Johansson, Jeremy Renner",United States,2012,PG-13,220000000.0,1518815515.0,143.0,24428.0,"Science Fiction,Action,Adventure,",Disney+
708,Marvel Studios' Thor,Kenneth Branagh,"Chris Hemsworth, Natalie Portman, Tom Hiddleston, Anthony Hopkins, Stellan Skarsgård, Kat Dennings",United States,2011,PG-13,150000000.0,449326618.0,115.0,10195.0,"Adventure,Fantasy,Action,",Disney+
709,Marvel Studios' Thor: The Dark World,Alan Taylor,"Chris Hemsworth, Natalie Portman, Tom Hiddleston, Anthony Hopkins, Rene Russo, Stellan Skarsgård",United States,2013,PG-13,170000000.0,644571402.0,112.0,76338.0,"Action,Adventure,Fantasy,",Disney+
710,Mary Poppins,Robert Stevenson,"Julie Andrews, Dick Van Dyke, David Tomlinson, Glynis Johns, Hermione Baddeley, Karen Dotrice",United States,1964,G,6000000.0,103082380.0,139.0,433.0,"Comedy,Family,Fantasy,",Disney+
711,Mater and the Ghostlight,John Lasseter,"Larry the Cable Guy , Owen Wilson, Michael Wallis, Bonnie Hunt, Paul Newman, Cheech Marin",United States,2006,TV-Y7,0.0,0.0,7.0,13934.0,"Animation,Comedy,Family,Horror,",Disney+
712,Meet the Deedles,Steve Boyum,"Paul Walker, Steve Wormer, John Ashton, A.J. Langer, Robert Englund, Megan Cavanagh",United States,1998,PG,24000000.0,4562146.0,93.0,40688.0,"Comedy,Family,",Disney+
713,Meet the Robinsons,Stephen Anderson,"Angela Bassett, Daniel Hansen, Jordan Fry, Matthew Josten, John Ford, Dara McGarry",United States,2007,G,150000000.0,169332978.0,95.0,1267.0,"Animation,Comedy,Family,",Disney+
714,Melody Time,"Clyde Geronimi, Jack Kinney, Hamilton Luske","Roy Rogers, Trigger , Dennis Day, The Andrews Sisters , Fred Waring and His Pennsylvanians , Freddy Martin",United States,1948,TV-PG,2000000.0,0.0,75.0,13757.0,"Music,Family,Animation,Comedy,",Disney+
715,Mickey Down Under,Charles Nichols,,United States,1948,TV-G,0.0,0.0,7.0,67004.0,"Animation,Family,",Disney+
716,"Mickey, Donald, Goofy: The Three Musketeers",Donovan Cook,"Wayne Allwine, Tony Anselmo, Bill Farmer, Russi Taylor, Tress MacNeille, Jim Cummings",United States,2004,G,0.0,0.0,68.0,21385.0,"Adventure,Animation,Comedy,Family,",Disney+
717,Mickey's Birthday Party,Riley Thomson,"Walt Disney, Thelma Boardman, Pinto Colvig, Clarence Nash, Florence Gill",United States,1942,TV-G,0.0,0.0,8.0,67009.0,"Animation,Comedy,Family,",Disney+
718,Mickey's Christmas Carol,Burny Mattinson,"Alan Young, Wayne Allwine, Hal Smith, Will Ryan, Eddy Carroll, Patricia Parris",United States,1983,G,3000000.0,21000000.0,26.0,14813.0,"Family,Animation,",Disney+
719,Mickey's Delayed Date,Charles Nichols,,United States,1947,TV-G,0.0,0.0,7.0,67043.0,"Animation,Comedy,",Disney+
720,Mickey's Once Upon a Christmas,"Bradley Raymond, Jun Falkenstein, Bill Speers","Kelsey Grammer, Wayne Allwine, Russi Taylor, Tony Anselmo, Diane Michelle, Tress MacNeille",United States,1999,TV-G,0.0,0.0,66.0,15400.0,"Animation,Family,Comedy,",Disney+
721,Mickey's Rival,"Wilfred Jackson, Walt Disney","Walt Disney, Marcelite Garner, Sonny Dawson",United States,1936,TV-G,0.0,0.0,8.0,67115.0,"Animation,Comedy,Family,Romance,",Disney+
722,Mickey's Trailer,Ben Sharpsteen,"Clarence Nash, Pinto Colvig, Walt Disney",United States,1938,TV-PG,0.0,0.0,7.0,53219.0,"Animation,Comedy,",Disney+
723,Mickey's Twice Upon a Christmas,Matthew O'Callaghan,"Wayne Allwine, Tony Anselmo, Jeff Bennett, Jim Cummings, Bill Farmer, Tress MacNeille",United States,2004,G,10000000.0,0.0,68.0,13378.0,"Animation,Family,",Disney+
724,Mighty Joe Young,Ron Underwood,"Bill Paxton, Charlize Theron, Rade Šerbedžija, Regina King, Peter Firth, Naveen Andrews",United States,1998,PG,90000000.0,0.0,114.0,9822.0,"Adventure,Family,Action,Fantasy,",Disney+
725,Mike's New Car,"Pete Docter, Roger Gould","Billy Crystal, John Goodman",United States,2002,TV-G,0.0,0.0,3.0,13931.0,"Animation,Comedy,Family,Fantasy,",Disney+
726,Minutemen,Lev Spiro,"Jason Dolley, Luke Benward, Nicholas Braun, Chelsea Staub, Steven McQueen, Kara Crane",United States,2008,TV-G,5000000.0,0.0,91.0,22371.0,"Family,TV Movie,Comedy,Science Fiction,Adventure,",Disney+
727,Miracle,Gavin O'Connor,"Kurt Russell, Patricia Clarkson, Noah Emmerich, Sean McCann, Kenneth Welsh, Eddie Cahill","Canada, United States",2004,PG,28000000.0,64445708.0,135.0,14292.0,"Drama,History,",Disney+
728,Miracle at Midnight,Ken Cameron,"Sam Waterston, Mia Farrow, Justin Whalin, Patrick Malahide, Benedick Blythe",United States,1998,TV-14,0.0,0.0,90.0,177212.0,"Drama,",Disney+
729,Miracle in Lane 2,Greg Beeman,"Frankie Muniz, Rick Rossovich, Molly Hagan, Patrick Levis, Roger Brown, Tuc Watkins",United States,2000,TV-G,0.0,0.0,89.0,77921.0,"TV Movie,Family,Drama,Comedy,",Disney+
730,Miracle Landing on the Hudson,,"Todd Boyce, Miriam Lucia, James McGregor, Nathan Nolan, Phillip Wright",United States,2014,TV-G,2000000.0,0.0,90.0,256423.0,"Documentary,",Disney+
731,Mission to the Sun,Daniel Smith,"Henry Goodman, Jack Baker",United States,2018,TV-PG,0.0,0.0,44.0,568161.0,"Documentary,",Disney+
732,Moana,"John Musker, Ron Clements","Auli'i Cravalho, Dwayne Johnson, Rachel House, Temuera Morrison, Nicole Scherzinger, Jemaine Clement",United States,2016,PG,150000000.0,690860472.0,107.0,277834.0,"Adventure,Comedy,Family,Animation,",Disney+
733,Mom's Got a Date With a Vampire,Stephen Boyum,"Matthew O'Leary, Laura Vandervoort, Myles Jeffrey, Caroline Rhea, Charles Shaughnessy, Robert Carradine","Canada, United States",2000,TV-PG,0.0,0.0,85.0,92208.0,"TV Movie,Comedy,Family,Fantasy,Horror,",Disney+
734,Monsters University,Dan Scanlon,"Billy Crystal, John Goodman, Steve Buscemi, Helen Mirren, Peter Sohn, Joel Murray",United States,2013,G,200000000.0,743559607.0,104.0,62211.0,"Animation,Family,",Disney+
735,"Monsters, Inc.",Pete Docter,"John Goodman, Billy Crystal, Mary Gibbs, Steve Buscemi, James Coburn, Jennifer Tilly",United States,2001,G,115000000.0,579707738.0,92.0,585.0,"Animation,Comedy,Family,",Disney+
736,Motocrossed,Steve Boyum,"Alana Austin, Riley Smith, Mary-Margaret Humes, Trever O'Brien, Timothy Carhart, Scott Terra",United States,2001,TV-G,0.0,0.0,91.0,71885.0,"TV Movie,Family,Comedy,Drama,Romance,",Disney+
737,Mr. Boogedy,Oz Scott,"Richard Masur, Mimi Kennedy, Benjamin Gregory, David Faustino, Kristy Swanson, Howard Witt",United States,1986,TV-PG,0.0,0.0,44.0,365351.0,"TV Movie,Horror,Adventure,Drama,",Disney+
738,Mr. Duck Steps Out,Jack King,,United States,1940,TV-G,0.0,0.0,8.0,73999.0,"Animation,",Disney+
739,Mr. Mouse Takes a Trip,Clyde Geronimi,,United States,1940,TV-G,0.0,0.0,8.0,67132.0,"Animation,Family,Comedy,",Disney+
740,Mulan II,"Darrell Rooney, Lynne Southerland","Ming-Na Wen, B.D. Wong, Mark Moseley, Lucy Liu, Harvey Fierstein, Sandra Oh","United States, South Korea, Singapore, Russia, Malaysia, Kazakhstan, Taiwan, Hong Kong, Japan, China, India, Syria, Iran, Egypt, Pakistan",2005,G,0.0,0.0,79.0,12242.0,"Animation,Comedy,Family,Action,",Disney+
741,Muppet Treasure Island,Brian Henson,"Tim Curry, Kevin Bishop, Billy Connolly, Jennifer Saunders, Dave Goelz, Steve Whitmire",United States,1996,G,31000000.0,34327391.0,100.0,10874.0,"Action,Comedy,Music,Family,Adventure,Romance,",Disney+
742,Muppets Most Wanted,James Bobin,"Ricky Gervais, Ty Burrell, Tina Fey, Steve Whitmire, Eric Jacobson, Dave Goelz",United States,2014,PG,50000000.0,80383290.0,112.0,145220.0,"Comedy,Adventure,Crime,Family,",Disney+
743,My Favorite Martian,Donald Petrie,"Jeff Daniels, Christopher Lloyd, Elizabeth Hurley, Daryl Hannah, Wallace Shawn, Christine Ebersole",United States,1999,PG,65000000.0,36850101.0,94.0,9849.0,"Comedy,Drama,Family,Science Fiction,",Disney+
744,National Treasure: Book of Secrets,Jon Turteltaub,"Nicolas Cage, Jon Voight, Harvey Keitel, Ed Harris, Diane Kruger, Justin Bartha",United States,2007,PG,130000000.0,459242249.0,124.0,6637.0,"Action,Adventure,Mystery,Thriller,",Disney+
745,Newsies,Kenny Ortega,"Christian Bale, David Moscow, Bill Pullman, Gabriel Damon, Luke Edwards, Max Casella",United States,1992,PG,15000000.0,2706352.0,121.0,15300.0,"Family,Drama,History,Music,",Disney+
746,Newsies: The Broadway Musical,"Jeff Calhoun, Brett Sullivan","Jeremy Jordan, Kara Lindsay, Ben Fankhauser, Andrew Keenan-Bolger, Steve Blanchard, Aisha de Haas",United States,2017,PG,0.0,0.0,134.0,462477.0,"Romance,Music,History,Drama,",Disney+
747,Noelle,Marc Lawrence,"Anna Kendrick, Bill Hader, Kingsley Ben-Adir, Billy Eichner, Julie Hagerty, Shirley MacLaine",United States,2019,G,0.0,0.0,100.0,454467.0,"Family,Comedy,Fantasy,",Disney+
748,Now You See It,Duwayne Dunham,"Alyson Michalka, Johnny Pacar, Frank Langella, Brendan Hill, Chris Olivero, Gabriel Sunday",United States,2005,TV-G,0.0,0.0,96.0,26267.0,"TV Movie,Comedy,Mystery,",Disney+
749,Olaf's Frozen Adventure,"Stevie Wermers-Skelton, Kevin Deters","Josh Gad, Idina Menzel, Kristen Bell, Jonathan Groff, Chris Williams, John de Lancie",United States,2017,G,0.0,0.0,22.0,460793.0,"Animation,Family,Adventure,Comedy,Fantasy,",Disney+
750,Old Yeller,Robert Stevenson,"Dorothy McGuire, Fess Parker, Jeff York, Chuck Connors, Beverly Washburn, Tommy Kirk",United States,1957,G,0.0,0.0,84.0,22660.0,"Adventure,Drama,Family,Western,",Disney+
751,Oliver & Company,George Scribner,"Joey Lawrence, Billy Joel, Cheech Marin, Richard Mulligan, Roscoe Browne, Sheryl Ralph",United States,1988,G,10000000.0,37402877.0,153.0,17917.0,"Drama,Family,Music,",Disney+
752,Once Upon a Mattress,Kathleen Marshall,"Carol Burnett, Tracey Ullman, Denis O'Hare, Zooey Deschanel, Michael Boatman, Edward Hibbert",United States,2005,TV-PG,0.0,0.0,90.0,18506.0,"Comedy,Music,Romance,",Disney+
753,One Magic Christmas,Phillip Borsos,"Mary Steenburgen, Gary Basaraba, Elizabeth Harnois, Arthur Hill, Wayne Robson, Jan Rubes","Canada, United States",1985,G,0.0,13677222.0,88.0,13380.0,"Family,Fantasy,",Disney+
754,One Man Band,"Mark Andrews, Andrew Jimenez",,United States,2006,G,0.0,0.0,4.0,13933.0,"Animation,Comedy,Family,Music,",Disney+
755,Operation Dumbo Drop,Simon Wincer,"Danny Glover, Ray Liotta, Denis Leary, Doug Doug, Corin Nemec, Tcheky Karyo",United States,1995,PG,0.0,0.0,107.0,27281.0,"Action,Adventure,Comedy,Family,",Disney+
756,Paris To Pittsburgh,"Sidney Beaumont, Michael Bonfiglio",Rachel Brosnahan,United States,2018,TV-PG,0.0,0.0,77.0,608590.0,"Documentary,",Disney+
757,Partly Cloudy,Peter Sohn,"Tony Fucile, Lori Richardson",United States,2009,G,0.0,0.0,5.0,24480.0,"Animation,Family,Comedy,",Disney+
758,Party Central,Kelsey Mann,"John Goodman, Billy Crystal, Dave Foley, Sean Hayes, Joel Murray, Charlie Day",United States,2014,PG,0.0,0.0,6.0,258152.0,"Family,Comedy,Animation,",Disney+
759,Perri,"N. Paul Kenworthy, Ralph Wright",Winston Hibler,United States,1957,G,0.0,0.0,75.0,162139.0,"Family,Fantasy,Adventure,",Disney+
760,Pete's Dragon,David Lowery,"Bryce Howard, Oakes Fegley, Wes Bentley, Karl Urban, Oona Laurence, Isiah Whitlock Jr.",United States,2016,PG,65000000.0,143695338.0,103.0,294272.0,"Adventure,Family,Fantasy,",Disney+
761,Peter Pan,"Hamilton Luske, Clyde Geronimi, Wilfred Jackson","Bobby Driscoll, Kathryn Beaumont, Hans Conried, Bill Thompson, Heather Angel, Paul Collins",United States,1953,G,4000000.0,87404651.0,77.0,10693.0,"Animation,Family,Adventure,Fantasy,",Disney+
762,Peter Pan: Return to Never Land,Robin Budd,"Harriet Owen, Blayne Weaver, Corey Burton, Jeff Bennett, Kath Soucie, Andrew McDonough","United States, Canada, Australia",2002,G,20000000.0,109862682.0,72.0,16690.0,"Adventure,Fantasy,Animation,Family,",Disney+
763,Phantom of the Megaplex,Blair Treu,"Taylor Handley, Corinne Bohrer, Caitlin Wachs, Jacob Smith, Rich Hutchman, John Novak","United States, Canada",2000,TV-G,0.0,0.0,89.0,26450.0,"Action,Comedy,Family,Mystery,Horror,",Disney+
764,Phineas and Ferb the Movie: Across the 2nd Dimension,"Dan Povenmire, Robert Hughes","Vincent Martella, Ashley Tisdale, Thomas Brodie-Sangster, Caroline Rhea, Richard O'Brien, Dan Povenmire","United States, Taiwan, China",2011,TV-G,0.0,0.0,78.0,71689.0,"Animation,Comedy,Family,TV Movie,Adventure,Science Fiction,",Disney+
765,Phineas and Ferb: Mission Marvel,"Robert Hughes, Sue Perrotto","Vincent Martella, Ashley Tisdale, Thomas Brodie-Sangster, Caroline Rhea, Richard O'Brien, Dan Povenmire",,2013,TV-G,0.0,0.0,45.0,284019.0,"Animation,Family,Comedy,",Disney+
766,Piglet's Big Movie,Francis Glebas,"John Fiedler, Jim Cummings, Andre Stojka, Kath Soucie, Nikita Hopkins, Peter Cullen",United States,2003,G,46000000.0,62870546.0,75.0,13691.0,"Animation,Family,",Disney+
767,Pinocchio,"Ben Sharpsteen, Hamilton Luske","Dickie Jones, Christian Rub, Cliff Edwards, Evelyn Venable, Walter Catlett, Charles Judels",United States,1940,G,0.0,0.0,105.0,532639.0,"Fantasy,Adventure,Family,",Disney+
768,Piper,Alan Barillaro,,United States,2016,G,0.0,0.0,6.0,399106.0,"Family,Animation,",Disney+
769,Pirates of the Caribbean: At World's End,Gore Verbinski,"Johnny Depp, Orlando Bloom, Keira Knightley, Stellan Skarsgård, Bill Nighy, Chow Yun-Fat",United States,2007,PG-13,300000000.0,961000000.0,169.0,285.0,"Adventure,Fantasy,Action,",Disney+
770,Pirates of the Caribbean: Dead Man's Chest,Gore Verbinski,"Johnny Depp, Orlando Bloom, Keira Knightley, Stellan Skarsgård, Bill Nighy, Jack Davenport",United States,2006,PG-13,200000000.0,1065659812.0,151.0,58.0,"Adventure,Fantasy,Action,",Disney+
771,Pirates of the Caribbean: The Curse of the Black Pearl,Gore Verbinski,"Johnny Depp, Geoffrey Rush, Orlando Bloom, Keira Knightley, Jack Davenport, Kevin McNally",United States,2003,PG-13,140000000.0,655011224.0,143.0,22.0,"Adventure,Fantasy,Action,",Disney+
772,Pixel Perfect,Mark Dippé,"Ricky Ullman, Leah Pipes, Spencer Redford, Chris Williams, Tania Gunadi, Porscha Coleman",United States,2004,TV-G,0.0,0.0,85.0,124117.0,"Family,TV Movie,Science Fiction,Comedy,",Disney+
773,Planet of the Birds,,Rodd Houston,,2018,TV-PG,0.0,0.0,44.0,525023.0,"Documentary,",Disney+
774,Pluto and the Gopher,Charles Nichols,,United States,1950,TV-PG,0.0,0.0,7.0,175999.0,"Animation,Family,",Disney+
775,Pluto's Christmas Tree,Jack Hannah,"Jimmy MacDonald, Pinto Colvig, Clarence Nash, Ruth Clifford, Dessie Miller",United States,1952,TV-Y7,0.0,0.0,7.0,61080.0,"Animation,Comedy,Family,",Disney+
776,Pluto's Surprise Package,Charles Nichols,,United States,1949,TV-G,0.0,0.0,7.0,164972.0,"Animation,Comedy,Family,",Disney+
777,Pluto's Sweater,Charles Nichols,,United States,1949,TV-G,0.0,0.0,7.0,175997.0,"Animation,",Disney+
778,Pocahontas,"Mike Gabriel, Eric Goldberg","Irene Bedard, Judy Kuhn, Mel Gibson, David Ogden Stiers, John Kassir, Russell Means",United States,1995,G,55000000.0,346079773.0,81.0,10530.0,"Adventure,Animation,Family,Romance,",Disney+
779,Pocahontas II: Journey to a New World,"Bradley Raymond, Tom Ellery","Irene Bedard, Jim Cummings, Donal Gibson, Finola Hughes, Linda Hunt, Judy Kuhn",United States,1998,G,0.0,0.0,72.0,13761.0,"Family,Adventure,Animation,Romance,",Disney+
780,Pollyanna,David Swift,"Jane Wyman, Richard Egan, Karl Malden, Nancy Olson, Adolphe Menjou, Donald Crisp",United States,1960,G,2500000.0,3750000.0,134.0,31102.0,"Comedy,Drama,Family,",Disney+
781,Pooh's Grand Adventure: The Search for Christopher Robin,Karl Geurs,"Jim Cummings, John Fiedler, Ken Sansom, Andre Stojka, Peter Cullen, Brady Bluhm",United States,1997,TV-G,0.0,0.0,76.0,14903.0,"Animation,Family,Adventure,",Disney+
782,Pooh's Heffalump Movie,Frank Nissen,"Jim Cummings, John Fiedler, Nikita Hopkins, Kath Soucie, Ken Sansom, Peter Cullen",United States,2005,G,20000000.0,52900000.0,68.0,13682.0,"Family,Animation,Comedy,Fantasy,",Disney+
783,Presto,Doug Sweetland,,United States,2008,G,0.0,0.0,5.0,13042.0,"Animation,Family,",Disney+
784,Princess Protection Program,Allison Liddi-Brown,"Demi Lovato, Selena Gomez, Nicholas Braun, Molly Hagan, Johnny Rodriguez, Jamie Chung",United States,2009,TV-G,0.0,0.0,89.0,19458.0,"Family,TV Movie,Comedy,Drama,",Disney+
785,Purl,Kristen Lester,"Bret Parker, Emily Davis, Kelsey Mann, Austin Madison, Erik Langley, Michael Daley",United States,2019,PG,0.0,0.0,9.0,532953.0,"Animation,Comedy,",Disney+
786,Queen of Katwe,Mira Nair,"David Oyelowo, Lupita Nyong'o, Madina Nalwanga, Martin Kabanza, Taryn Kyaze, Esther Tebandeke",United States,2016,PG,15000000.0,10367161.0,124.0,317557.0,"Drama,",Disney+
787,Quints,Bill Corcoran,"Kimberly Brown, Daniel Roebuck, Elizabeth Morehead, Shadia Simmons, Jake Epstein, Vince Corazza","Canada, United States",2000,TV-G,0.0,0.0,83.0,101514.0,"Drama,Family,Comedy,TV Movie,",Disney+
788,Ratatouille,Brad Bird,"Patton Oswalt, Ian Holm, Lou Romano, Brian Dennehy, Peter Sohn, Peter O'Toole",United States,2007,G,150000000.0,623726000.0,111.0,2062.0,"Animation,Comedy,Family,Fantasy,",Disney+
789,Read It and Weep,Paul Hoen,"Kay Panabaker, Jason Dolley, Robin Riker, Tom Virtue, Alexandra Krosney, Danielle Panabaker",United States,2006,TV-G,0.0,0.0,90.0,4641.0,"Family,Comedy,Drama,TV Movie,",Disney+
790,Ready to Run,Duwayne Dunham,"Krissy Perez, Jason Dohring, Lillian Hurst, Jon Brazier, Nestor Serrano, Theresa Saldana","United States, New Zealand",2000,TV-G,0.0,0.0,88.0,77576.0,"Family,TV Movie,",Disney+
791,Recess: All Growed Down,"Howy Parkins, Chuck Sheetz","Rickey Collins, Jason Davis, Ashley Johnson, Myles Jeffrey, Andrew Lawrence, Ross Malinger",United States,2003,G,0.0,0.0,61.0,84331.0,"Family,Comedy,Animation,",Disney+
792,Recess: School's Out,Chuck Sheetz,"Rickey Collins, Jason Davis, Ashely Johnson, Andy Lawrence, Courtland Mead, Pam Segall","United States, Japan",2001,G,10000000.0,44460850.0,82.0,19405.0,"Science Fiction,Family,Comedy,Animation,",Disney+
793,Recess: Taking the 5th Grade,Howy Parkins,"Rickey Collins, Jason Davis, Myles Jeffrey, Ashley Johnson, Courtland Mead, Pamela Adlon",United States,2003,G,,,,,,Disney+
794,Red's Dream,John Lasseter,,United States,1987,TV-G,0.0,0.0,4.0,13926.0,"Animation,Family,",Disney+
795,Remember the Titans,Boaz Yakin,"Denzel Washington, Will Patton, Donald Faison, Wood Harris, Ryan Hurst, Ethan Suplee",United States,2000,PG,30000000.0,136706683.0,113.0,10637.0,"Drama,",Disney+
796,Rescue Dog,Charles Nichols,,United States,1947,TV-G,0.0,0.0,84.0,981451.0,"TV Movie,",Disney+
797,Return from Witch Mountain,John Hough,"Bette Davis, Christopher Lee, Kim Richards, Ike Eisenmann, Jack Soo, Anthony James",United States,1978,G,0.0,16393000.0,95.0,14822.0,"Adventure,Fantasy,Science Fiction,Family,",Disney+
798,Return to Halloweentown,David Jackson,"Sara Paxton, Judith Hoag, Lucas Grabeel, J. Zimmerman, Kristy Wu, Keone Young",United States,2006,TV-PG,0.0,0.0,88.0,34204.0,"Family,Fantasy,Comedy,TV Movie,Action,",Disney+
799,Return to Oz,Walter Murch,"Nicol Williamson, Jean Marsh, Piper Laurie, Matt Clark, Fairuza Balk, Michael Sundin","United Kingdom, United States",1985,PG,25000000.0,11137801.0,109.0,13155.0,"Adventure,Family,Fantasy,",Disney+
800,Richie Rich's Christmas Wish,John Murlowski,"David Gallagher, Eugene Levy, Keene Curtis, Jake Richardson, Martin Mull, Lesley Warren",United States,1998,G,6000000.0,0.0,84.0,73961.0,"Family,Comedy,",Disney+
801,Right on Track,Duwayne Dunham,"Beverley Mitchell, Brie Larson, Marcus Toji, Jodi Russell, Jon Lindstrom, Ruby O'Neil",United States,2003,TV-G,0.0,0.0,89.0,77606.0,"Drama,Family,TV Movie,",Disney+
802,Riley’s First Date?,Josh Cooley,"Lori Alan, Carlos Alazraqui, Lewis Black, Josh Cooley, Ben Cox, Kaitlyn Dias",United States,2015,G,0.0,0.0,8.0,355338.0,"Animation,Family,",Disney+
803,Rip Girls,Joyce Chopra,"Camilla Belle, Dwier Brown, Stacie Hess, Brian Stark, Jeanne Mori, Lauren Sinclair","Australia, United States",2000,TV-G,0.0,0.0,87.0,64269.0,"Drama,Family,Romance,TV Movie,",Disney+
804,Robin Hood,Wolfgang Reitherman,"Roger Miller, Peter Ustinov, Terry-Thomas , Brian Bedford, Monica Evans, Phil Harris",United States,1973,G,200000000.0,321669741.0,140.0,20662.0,"Action,Adventure,Drama,",Disney+
805,Rogue One: A Star Wars Story,Gareth Edwards,"Felicity Jones, Diego Luna, Ben Mendelsohn, Donnie Yen, Mads Mikkelsen, Alan Tudyk",United States,2016,PG-13,200000000.0,1056057273.0,133.0,330459.0,"Action,Adventure,Science Fiction,",Disney+
806,Roving Mars,George Butler,"Paul Newman, Steve Squyres, Rob Manning, Dr. Elachi, Wayne Lee",United States,2006,G,0.0,0.0,40.0,18085.0,"Documentary,",Disney+
807,Ruby Bridges,Euzhan Palcy,"Penelope Miller, Kevin Pollak, Michael Beach, Jean Kelly, Peter James, Patrika Darbo",United States,1998,TV-PG,0.0,0.0,96.0,96715.0,"Drama,Family,History,",Disney+
808,Sacred Planet,Jon Long,"Robert Redford, Arapata McKay, Tsaan Ciqae, Mae Tui, Cy Peck Jr., Mutang Urud","Canada, Malaysia, United States",2004,G,0.0,0.0,40.0,66860.0,"Documentary,",Disney+
809,Saludos Amigos,"Bill Roberts, Jack Kinney, Ham Luske",Fred Shields,United States,1943,TV-PG,0.0,1135000.0,42.0,14906.0,"Animation,Family,Adventure,",Disney+
810,"Sammy, The Way-Out Seal",Norman Tokar,"Jack Carson, Robert Culp, Patricia Barry, Elisabeth Fraser, Michael McGreevey, Billy Mummy",United States,1962,TV-G,0.0,0.0,88.0,297487.0,"Comedy,Family,TV Movie,",Disney+
811,Sanjay's Super Team,Sanjay Patel,"Brenton Schraff, Sunny Attar, Arun Rao, Jaquelynn Herrera",United States,2015,PG,0.0,0.0,7.0,345637.0,"Animation,Family,Fantasy,Action,",Disney+
812,Santa Paws 2: The Santa Pups,Robert Vince,"Cheryl Ladd, George Newbern, Pat Finn, Danny Woodburn, Obba Babatunde, Paul Rae",United States,2012,G,0.0,0.0,88.0,142308.0,"Family,Fantasy,Adventure,",Disney+
813,Santa's Workshop,Wilfred Jackson,,United States,1932,TV-G,13157.0,0.0,7.0,67167.0,"Animation,",Disney+
814,Saving Mr. Banks,John Hancock,"Emma Thompson, Tom Hanks, Colin Farrell, Paul Giamatti, Jason Schwartzman, Bradley Whitford","United States, United Kingdom, Australia",2013,PG-13,35000000.0,112544580.0,125.0,140823.0,"Comedy,Drama,History,",Disney+
815,Science Fair,"Cristina Costantini, Darren Foster","Anjali Chadha, Ryan Folz, Harsha Paladugu, Abraham Riedel-Mishaan, Kashfia Rahman, Ivo Zell",United States,2018,PG,0.0,0.0,90.0,493121.0,"Documentary,",Disney+
816,Sea of Hope: America's Underwater Treasures,Robert Nixon,Max Kennedy,United States,2017,TV-PG,0.0,0.0,60.0,433118.0,"Documentary,",Disney+
817,Secret of The Wings,Peggy Holmes,"Mae Whitman, Lucy Hale, Timothy Dalton, Jeff Bennett, Lucy Liu, Raven-Symoné","United States, India, United Kingdom",2012,G,0.0,0.0,92.0,75258.0,"Animation,Family,Fantasy,Adventure,",Disney+
818,Secretariat,Randall Wallace,"Diane Lane, John Malkovich, Dylan Walsh, James Cromwell, Kevin Connolly, Nelsan Ellis",United States,2010,PG,35000000.0,60321861.0,123.0,39486.0,"Drama,",Disney+
819,Secrets of Christ's Tomb: Explorer Special,Bob Strange,,United States,2017,TV-PG,0.0,0.0,46.0,526736.0,"Documentary,",Disney+
820,Secrets of Life,James Algar,Winston Hibler,United States,1956,TV-PG,0.0,0.0,70.0,162117.0,"Documentary,",Disney+
821,Secrets of the King Cobra,,Andre Braugher,India,2012,TV-PG,0.0,0.0,46.0,649172.0,"Documentary,",Disney+
822,Sharks of Lost Island,,Chris McLinden,United States,2013,TV-PG,0.0,0.0,45.0,649174.0,"Documentary,",Disney+
823,Sharpay's Fabulous Adventure,Michael Lembeck,"Ashley Tisdale, Austin Butler, Cameron Goodman, Bradley Perry, Alec Mapa, Jack Plotnick",United States,2011,TV-G,0.0,0.0,90.0,60405.0,"Family,Music,",Disney+
824,Shipwrecked,Nils Gaup,"Stian Smestad, Trond Peter Munch, Louisa Haigh, Gabriel Byrne, Bjørn Sundquist, Eva von Hanno","Norway, Sweden, United States",1991,PG,0.0,0.0,10.0,420086.0,"Adventure,Drama,",Disney+
825,Simpsons Movie,David Silverman,"Dan Castellaneta, Julie Kavner, Nancy Cartwright, Yeardley Smith, Harry Shearer, Hank Azaria",United States,2007,PG-13,75000000.0,527068851.0,87.0,35.0,"Animation,Comedy,Family,",Disney+
