,title,director,cast,country,release_year,rating,budget,revenue,runtime,movie_id,genre,streaming
563,Eddie's Million Dollar Cook-off,Paul Hoen,"Taylor Ball, Orlando Brown, Reiley McClendon, Mark Taylor, Rose McIver, Kylie Leydon",United States,2003,TV-G,0.0,0.0,85.0,124097.0,"Comedy,Family,TV Movie,",Disney+
564,Eight Below,Frank Marshall,"Paul Walker, Bruce Greenwood, Moon Bloodgood, Wendy Crewson, Gerard Plunkett, August Schellenberg",United States,2006,PG,40000000.0,120455994.0,120.0,9036.0,"Adventure,Drama,Family,",Disney+
565,Emil and the Detectives,Peter Tewksbury,"Walter Slezak, Roger Mobley, Heinz Schubert, Peter Ehrlich, Cindy Cassell, Elsa Wagner",United States,1964,TV-PG,0.0,0.0,99.0,4542.0,"Action,Adventure,Comedy,Crime,",Disney+
566,Empire of Dreams: The Story of the Star Wars Trilogy,"Edith Becker, Kevin Burns","Robert Clotworthy, Walter Cronkite, Anthony Daniels, Warwick Davis, Carrie Fisher, Harrison Ford",United States,2004,TV-14,0.0,0.0,151.0,76180.0,"Documentary,",Disney+
567,Escape to Witch Mountain,John Hough,"Eddie Albert, Ray Milland, Donald Pleasence, Kim Richards, Ike Eisenmann, Walter Barnes",United States,1975,G,0.0,20000000.0,97.0,14821.0,"Adventure,Fantasy,Science Fiction,Family,",Disney+
568,Expedition Mars: Spirit & Opportunity,Mark Davis,Bray Poor,United States,2019,TV-PG,0.0,0.0,88.0,429324.0,"Documentary,TV Movie,",Disney+
569,Fantasia,"Samuel Armstrong, James Algar, Bill Roberts","Deems Taylor, Walt Disney, Leopold Stokowski",United States,1940,G,2280000.0,76411819.0,124.0,756.0,"Animation,Family,",Disney+
570,Fantasia 2000,"Pixote Hunt, Hendel Butoy, Eric Goldberg","Steve Martin, Itzhak Perlman, Quincy Jones, Bette Midler, James Jones, Penn Teller",United States,2000,G,80000000.0,60655420.0,74.0,49948.0,"Animation,Family,Music,",Disney+
571,Ferdinand the Bull,Dick Rickard,,United States,1938,TV-G,66260.0,0.0,8.0,47166.0,"Animation,Comedy,Family,",Disney+
572,Finding Dory,"Andrew Stanton, Angus MacLane","Ellen DeGeneres, Albert Brooks, Ed O'Neill, Kaitlin Olson, Hayden Rolence, Ty Burrell",United States,2016,PG,200000000.0,1028570889.0,97.0,127380.0,"Adventure,Animation,Comedy,Family,",Disney+
573,Finding Nemo,Andrew Stanton,"Albert Brooks, Ellen DeGeneres, Alexander Gould, Willem Dafoe, Brad Garrett, Allison Janney","United States, Australia",2003,G,94000000.0,940335536.0,100.0,12.0,"Animation,Family,",Disney+
574,First Kid,David Evans,"Sinbad , Robert Guillaume, Timothy Busfield, Brock Pierce, James Naughton, Art Fleur",United States,1996,PG,0.0,0.0,101.0,12559.0,"Comedy,Family,",Disney+
575,Flight of the Navigator,Randal Kleiser,"Joey Cramer, Veronica Cartwright, Cliff De Young, Sarah Parker, Matt Adler, Howard Hesseman",United States,1986,PG,9000000.0,18564613.0,90.0,10122.0,"Family,Science Fiction,Adventure,",Disney+
576,Float,Bobby Rubio,"Eli Fucile, Bobby Rubio, Luna Watson, Mika Kubo",United States,2019,PG,0.0,0.0,76.0,1038043.0,"Horror,",Disney+
577,Flowers and Trees,Burt Gillett,,United States,1932,TV-Y7,15887.0,0.0,8.0,106112.0,"Animation,",Disney+
578,Flubber,Les Mayfield,"Robin Williams, Marcia Harden, Christopher McDonald, Raymond Barry, Clancy Brown, Ted Levine",United States,1997,PG,80000000.0,177977226.0,93.0,9574.0,"Comedy,Family,Science Fiction,",Disney+
579,Food for Feudin',Charles Nichols,,United States,1950,TV-G,0.0,0.0,7.0,74965.0,"Animation,Family,",Disney+
580,For the Birds,Ralph Eggleston,,United States,2001,G,0.0,0.0,3.0,13930.0,"Animation,Family,Comedy,",Disney+
581,Forky Asks a Question: What is Money?,Bob Peterson,"Tony Hale, John Ratzenberger, Bob Peterson",United States,2019,TV-G,0.0,0.0,3.0,660851.0,"Animation,Family,Comedy,",Disney+
582,Frank and Ollie,Theodore Thomas,"Frank Thomas, Ollie Johnston, Sylvia Roemer, John Canemaker, John Culhane, Marie Johnston",United States,1995,PG,0.0,0.0,89.0,42981.0,"Documentary,",Disney+
583,Frankenweenie (Short),Tim Burton,"Shelley Duvall, Daniel Stern, Barret Oliver",United States,1984,PG,,,,,,Disney+
584,Freaky Friday,Mark Waters,"Jamie Curtis, Lindsay Lohan, Harold Gould, Chad Murray, Stephen Tobolowsky, Christina Vidal",United States,2003,PG,26000000.0,160846332.0,97.0,10330.0,"Comedy,Family,Romance,Fantasy,",Disney+
585,Free Solo,"Elizabeth Vasarhelyi, Jimmy Chin","Alex Honnold, Tommy Caldwell",United States,2018,TV-PG,0.0,21790193.0,100.0,515042.0,"Documentary,Adventure,",Disney+
586,Frenemies,Daisy Mayer,"Zendaya , Bella Thorne, Mary Mouser, Nick Robinson, Stefanie Scott, Connor Price",United States,2012,TV-G,0.0,0.0,86.0,84105.0,"Drama,Family,TV Movie,Comedy,",Disney+
587,Frozen,"Chris Buck, Jennifer Lee","Kristen Bell, Idina Menzel, Jonathan Groff, Josh Gad, Santino Fontana, Alan Tudyk",United States,2013,PG,150000000.0,1274219009.0,102.0,109445.0,"Animation,Family,Adventure,Fantasy,",Disney+
588,Full-Court Miracle,Stuart Gillard,"Alex Linz, R.H. Thomson, Sean Marquette, Jase Blankfort, Erik Knudsen, David Sazant",United States,2003,TV-G,0.0,0.0,90.0,158265.0,"TV Movie,Family,",Disney+
589,Fun and Fancy Free,"Jack Kinney, W. Roberts, Hamilton Luske","Edgar Bergen, Dinah Shore, Luana Patten, Clarence Nash, Mickey Mouse, Cliff Edwards",United States,1947,G,0.0,0.0,73.0,46929.0,"Animation,Family,Music,",Disney+
590,Fuzzbucket,Mick Garris,"Chris Hebert, Phil Fondacaro, Joe Regalbuto, Wendy Phillips, Robyn Lively, John Vernon",United States,1986,TV-G,0.0,0.0,46.0,210103.0,"Adventure,Comedy,Family,TV Movie,",Disney+
591,Geek Charming,Jeffrey Hornaday,"Sarah Hyland, Matt Prokop, Sasha Pieterse, Jordan Nichols, Vanessa Morgan, Lili Simmons",United States,2011,TV-G,0.0,0.0,99.0,81250.0,"Comedy,Drama,Family,TV Movie,",Disney+
592,Genius,Rod Daniel,"Trevor Morgan, Emmy Rossum, Yannick Bisson, Peter Keleghan, Philip Granger, Charles Fleischer",United States,1999,TV-G,0.0,5681622.0,104.0,267192.0,"History,Drama,",Disney+
593,George & A.J.,Josh Cooley,"Jason Topolski, A.J. Riebli  III, Steve Purcell, Peter Sohn, Bob Peterson, Kim Donovan",United States,2009,TV-G,0.0,0.0,88.0,918832.0,"Animation,Adventure,Comedy,",Disney+
594,Geri's Game,Jan Pinkava,Bob Peterson,United States,1997,G,0.0,0.0,4.0,13929.0,"Animation,Family,",Disney+
595,Get a Clue,Maggie Greenwald,"Lindsay Lohan, Bug Hall, Ian Gomez, Brenda Song, Ali Mukadam, Dan Lett",United States,2002,TV-G,0.0,0.0,83.0,26189.0,"Family,Comedy,Mystery,TV Movie,",Disney+
596,Giants of the Deep Blue,Ken Corben,Bill Graves,,2018,TV-PG,0.0,0.0,44.0,546111.0,"Documentary,",Disney+
597,Go Figure,Francine McDougall,"Jordan Hinson, Whitney Sloan, Cristine Rose",United States,2005,TV-G,0.0,0.0,88.0,55504.0,"TV Movie,Comedy,Drama,Family,",Disney+
598,Going to the Mat,Stuart Gillard,"Andrew Lawrence, Khleo Thomas, Alessandra Toreson, Billy Brown, Brenda Strong, Brian Wimmer",United States,2004,TV-G,0.0,0.0,96.0,122987.0,"TV Movie,Drama,Family,",Disney+
599,"Good Luck Charlie, It's Christmas!",Arlene Sanford,"Bridgit Mendler, Leigh-Allyn Baker, Bradley Perry, Mia Talerico, Debra Monk, Michael Kagan",United States,2011,TV-G,0.0,0.0,85.0,81440.0,"TV Movie,Comedy,Family,",Disney+
600,Gotta Kick it Up,Ramon Menendez,"Camille Guaty, America Ferrera, Jhoanna Flores, Suilma Rodriguez, Sabrina Wiener, Miguel Sandoval",United States,2002,TV-G,0.0,0.0,78.0,124108.0,"TV Movie,Comedy,Drama,",Disney+
601,Grand Canyonscope,C. Nichols,,United States,1954,TV-G,0.0,0.0,7.0,61447.0,"Animation,",Disney+
602,Grasshopper and the Ants,Wilfred Jackson,,United States,1934,TV-G,22120.0,0.0,8.0,81077.0,"Animation,",Disney+
603,Greyfriars Bobby,Don Chaffey,"Donald Crisp, Laurence Naismith, Alex Mackenzie, Duncan Macrae, Andrew Cruickshank, Gordon Jackson",United States,1961,TV-G,0.0,0.0,104.0,73772.0,"Drama,Family,",Disney+
604,Gus,Vincent McEveety,"Edward Asner, Don Knotts, Gary Grimes, Tim Conway, Liberty Williams, Dick Van Patten",United States,1976,G,0.0,0.0,96.0,20639.0,"Comedy,Family,",Disney+
605,Halloweentown,Duwayne Dunham,"Debbie Reynolds, Judith Hoag, Kimberly Brown, Joey Zimmerman, Phillip Van Dyke, Emily Roeske",United States,1998,TV-PG,0.0,0.0,84.0,27850.0,"Adventure,Comedy,Family,Fantasy,TV Movie,",Disney+
606,Halloweentown High,Mark Dippé,"Kimberly Brown, Judith Hoag, Joey Zimmerman, Emily Roeske, Clifton Davis, Finn Wittrock",United States,2004,TV-G,0.0,0.0,82.0,34560.0,"Adventure,Comedy,Family,Fantasy,TV Movie,",Disney+
607,Halloweentown II: Kalabar's Revenge,Mary Lambert,"Kimberly Brown, Judith Hoag, Daniel Kountz, Joseph Zimmerman, Emily Roeske, Phillip Van Dyke",United States,2001,TV-PG,0.0,0.0,81.0,34205.0,"Adventure,Family,Fantasy,TV Movie,",Disney+
608,Hannah Montana and Miley Cyrus: Best of Both Worlds Concert,Bruce Hendricks,"Miley Cyrus, Joe Jonas, Kevin Jonas, Nick Jonas, Kenny Ortega, Billy Cyrus",United States,2008,G,7000000.0,70642966.0,82.0,253353.0,"Documentary,Music,",Disney+
609,Hannah Montana The Movie,Peter Chelsom,"Miley Cyrus, Emily Osment, Margo Martindale, Jason Earles, Peter Gunn, Melora Hardin",United States,2009,G,35000000.0,155545279.0,102.0,18126.0,"Comedy,Drama,Family,Music,Romance,",Disney+
610,Hatching Pete,Stuart Gillard,"Jason Dolley, Mitchel Musso, Tiffany Thornton, Josie Loren, Sean O'Bryan, Amy Farrington",United States,2009,TV-G,0.0,0.0,90.0,52699.0,"Family,Comedy,TV Movie,",Disney+
611,Hawaiian Holiday,Ben Sharpsteen,"Walt Disney, Marcellite Garner, Clarence Nash, Pinto Colvig",United States,1937,TV-G,0.0,0.0,8.0,66872.0,"Animation,Comedy,Family,",Disney+
612,Heavyweights,Steven Brill,"Tom McGowan, Aaron Schwartz, Shaun Weiss, Tom Hodges, Leah Lail, Paul Feig",United States,1995,PG,10000000.0,17689177.0,100.0,14819.0,"Family,Comedy,Drama,",Disney+
613,Herbie Goes Bananas,Vincent McEveety,"Cloris Leachman, Charles Smith, John Vernon, Stephen Burns, Elyssa Davalos, Joaquin Garay  III",United States,1980,G,0.0,18000000.0,110.0,12129.0,"Fantasy,Comedy,Family,Adventure,",Disney+
614,Herbie Goes to Monte Carlo,Vincent McEveety,"Dean Jones, Don Knotts, Julie Sommars, Jacques Marin, Roy Kinnear, Bernard Fox",United States,1977,G,0.0,29000000.0,105.0,14140.0,"Romance,Comedy,Family,Action,Adventure,",Disney+
615,Herbie Rides Again,Robert Stevenson,"Helen Hayes, Ken Berry, Stefanie Powers, John McIntire, Keenan Wynn, Huntz Hall",United States,1974,G,0.0,38229000.0,88.0,10869.0,"Romance,Comedy,Family,Fantasy,",Disney+
616,Hercules,"John Musker, Ron Clements","Tate Donovan, Joshua Keaton, Roger Bart, Danny DeVito, James Woods, Susan Egan","United States, France",1997,G,85000000.0,252712101.0,93.0,11970.0,"Animation,Family,Fantasy,Adventure,Comedy,Romance,",Disney+
617,High School Musical,Kenny Ortega,"Zac Efron, Vanessa Hudgens, Ashley Tisdale, Lucas Grabeel, Alyson Reed, Corbin Bleu",United States,2006,TV-G,4200000.0,0.0,98.0,10947.0,"Comedy,Drama,Family,Music,Romance,TV Movie,",Disney+
618,High School Musical 2,Kenny Ortega,"Zac Efron, Vanessa Hudgens, Ashley Tisdale, Lucas Grabeel, Corbin Bleu, Monique Coleman",United States,2007,TV-G,0.0,7000000.0,111.0,13649.0,"Comedy,Drama,Family,Music,Romance,TV Movie,",Disney+
619,High School Musical 3: Senior Year,Kenny Ortega,"Zac Efron, Vanessa Hudgens, Ashley Tisdale, Lucas Grabeel, Corbin Bleu, Monique Coleman",United States,2008,G,11000000.0,252909177.0,117.0,11887.0,"Comedy,Romance,Drama,Family,Music,",Disney+
620,Hocus Pocus,Kenny Ortega,"Bette Midler, Sarah Parker, Kathy Najimy, Omri Katz, Thora Birch, Vinessa Shaw",United States,1993,PG,30000000.0,0.0,107.0,642885.0,"Fantasy,Comedy,Family,",Disney+
621,Home on the Range,"Will Finn, John Sanford","Roseanne Barr, Judi Dench, Jennifer Tilly, Steve Buscemi, G.W. Bailey, Cuba Gooding Jr.",United States,2004,PG,110000000.0,103951461.0,76.0,13700.0,"Animation,Family,",Disney+
622,"Honey, I Blew Up the Kid",Randal Kleiser,"Rick Moranis, Marcia Strassman, Lloyd Bridges, Robert Oliveri, John Shea, Keri Russell",United States,1992,PG,40000000.0,58662452.0,89.0,11158.0,"Adventure,Comedy,Family,Science Fiction,",Disney+
623,"Honey, I Shrunk the Kids",Joe Johnston,"Rick Moranis, Matt Frewer, Marcia Strassman, Kristine Sutherland, Thomas Brown, Jared Rushton","United States, Mexico",1989,PG,18000000.0,222724172.0,93.0,9354.0,"Adventure,Comedy,Family,Science Fiction,",Disney+
624,"Honey, We Shrunk Ourselves",Dean Cundey,"Rick Moranis, Eve Gordon, Robin Bartlett, Allison Mack, Jake Richardson, Stuart Pankin",United States,1997,PG,7000000.0,0.0,74.0,11425.0,"Adventure,Comedy,Family,Science Fiction,Action,",Disney+
625,Horse Sense,Greg Beeman,"Joey Lawrence, Andy Lawrence, Susan Walters, M.C. Gainey, Leann Hunley, Robin Thomas",United States,1999,TV-G,0.0,0.0,92.0,6980.0,"Drama,Family,TV Movie,",Disney+
626,Hounded,Neal Israel,"Tahj Mowry, Shia LaBeouf, Craig Kirkwood, Steven Bendik, Sara Paxton, Rachelle Carson",United States,2001,TV-G,0.0,0.0,94.0,935999.0,"Horror,Action,Thriller,",Disney+
627,How Dogs Got Their Shapes,,Jake Robards,United States,2016,TV-PG,0.0,0.0,44.0,647672.0,"Documentary,",Disney+
628,How to Build a Better Boy,Paul Hoen,"Ashley Argota, Roger Bart, Kelli Berglund, Noah Centineo, China McClain, Matt Shively",United States,2014,TV-G,0.0,0.0,90.0,286987.0,"Family,Science Fiction,TV Movie,",Disney+
629,How to Fish,Jack Kinney,John McLeish,United States,1942,TV-G,0.0,0.0,7.0,66884.0,"Family,Animation,Comedy,",Disney+
630,How to Swim,Jack Kinney,,United States,1942,TV-G,0.0,0.0,8.0,66986.0,"Animation,",Disney+
631,I'll Be Home for Christmas,Arlene Sanford,"Jonathan Thomas, Jessica Biel, Adam LaVorgna, Gary Cole, Eve Gordon, Lauren Maltby","United States, Canada",1998,PG,30000000.0,0.0,86.0,17037.0,"Comedy,Family,",Disney+
632,Ice Age: The Great Egg-Scapade,Ricardo Curtis,"Raymond Albert Romano, John Leguizamo, Denis Leary, Queen Latifah",United States,2016,TV-G,0.0,0.0,25.0,387893.0,"Adventure,Animation,Comedy,Family,TV Movie,",Disney+
633,Ice Princess,Tim Fywell,"Joan Cusack, Kim Cattrall, Michelle Trachtenberg, Hayden Panettiere, Trevor Blumas, Connie Ray","United States, Canada",2005,G,25000000.0,27645491.0,98.0,13374.0,"Family,Drama,Comedy,",Disney+
634,Inner Workings,Leo Matsuda,"Este Haim, Tucker Gilmore, Raymond Persi, Terri Douglas",United States,2016,G,0.0,0.0,7.0,406785.0,"Animation,Family,Comedy,",Disney+
635,Inside Out,Pete Docter,"Amy Poehler, Phyllis Smith, Richard Kind, Bill Hader, Lewis Black, Mindy Kaling",United States,2015,PG,175000000.0,857611174.0,95.0,150540.0,"Animation,Family,Adventure,Drama,Comedy,",Disney+
636,Inspector Gadget,David Kellogg,"Matthew Broderick, Rupert Everett, Joely Fisher, Michelle Trachtenberg, Michael Hagerty, Andy Dick",United States,1999,PG,75000000.0,134400000.0,78.0,332.0,"Action,Adventure,Comedy,Family,",Disney+
637,Inspector Gadget 2,Alex Zamm,"French Stewart, Elaine Hendrix, Caitlin Wachs, Tony Martin, John Batchelor, Mark Mitchell",United States,2003,G,12000000.0,0.0,89.0,19766.0,"Action,Adventure,Comedy,Family,",Disney+
638,Into the Grand Canyon,Pete McBride,,United States,2019,TV-PG,0.0,0.0,84.0,584765.0,"Documentary,",Disney+
639,Into the Okavango,Neil Gelinas,"Steve Boyes, Dr. Steve Boyes, Chris Boyes, Tumeletso Setlabosha, Gobonamang Kgetho, Adjany Costa","United States, Angola, Botswana, Namibia, South Africa",2018,TV-PG,0.0,0.0,94.0,520446.0,"Documentary,",Disney+
640,Invincible,Ericson Core,"Mark Wahlberg, Greg Kinnear, Elizabeth Banks, Michael Rispoli, Kevin Conway, Kirk Acevedo",United States,2006,PG,0.0,57806952.0,105.0,11652.0,"Drama,History,",Disney+
641,Invisible Sister,Paul Hoen,"Rowan Blanchard, Paris Berelc, Karan Brar, Rachel Crow, Alex Désert, Will Meyers",United States,2015,TV-G,0.0,0.0,77.0,360605.0,"Fantasy,Adventure,Comedy,TV Movie,",Disney+
642,Iron Will,Charles Haid,"Mackenzie Astin, Kevin Spacey, David Ogden Stiers, August Schellenberg, Brian Cox, George Gerdes",United States,1994,PG,0.0,21006361.0,108.0,24767.0,"Adventure,Family,Action,",Disney+
643,Jack,Francis Coppola,"Robin Williams, Diane Lane, Brian Kerwin, Jennifer Lopez, Bill Cosby, Fran Drescher",United States,1996,PG-13,60000000.0,218340595.0,130.0,75780.0,"Crime,Drama,Thriller,Action,",Disney+
644,Jack-Jack Attack,Brad Bird,"Bret Parker, Bud Luckey, Eli Fucile, Jason Lee",United States,2005,G,0.0,0.0,5.0,13932.0,"Adventure,Animation,Family,",Disney+
645,James and the Giant Peach,Henry Selick,"Miriam Margolyes, Joanna Lumley, Pete Postlethwaite, Paul Terry, Simon Callow, Richard Dreyfuss","United Kingdom, United States",1996,PG,38000000.0,28946127.0,79.0,10539.0,"Adventure,Animation,Family,Fantasy,",Disney+
646,Jane,Brett Morgen,Jane Goodall,United States,2017,PG,50000000.0,48169156.0,125.0,4421.0,"Action,Drama,",Disney+
647,Jingle Pols,,Dr. Pol,,2013,TV-14,,,,,,Disney+
648,Johnny Kapahala: Back on Board,Eric Bross,"Brandon Baker, Robyn Lively, Mary Keller, Yuji Okumoto, Jonathan McDaniel, Andrew Allen",United States,2007,TV-G,0.0,0.0,90.0,62527.0,"Family,Comedy,Drama,TV Movie,",Disney+
649,Johnny Tsunami,Steve Boyum,"Cary-Hiroyuki Tagawa, Brandon Baker, Yuji Okumoto, Mary Keller, Lee Young, Kirsten Storms",United States,1999,TV-G,0.0,0.0,88.0,24020.0,"Family,TV Movie,Drama,",Disney+
650,Jonas Brothers: The Concert Experience,Bruce Hendricks,"Kevin Jonas, Joe Jonas, Nick Jonas, Demi Lovato, Taylor Swift, ""Big Feggans",United States,2009,G,0.0,0.0,76.0,40534.0,"Documentary,Music,",Disney+
651,Journey to Shark Eden,,Salvatore Vecchio,United States,2010,TV-G,0.0,0.0,60.0,122739.0,"Documentary,",Disney+
652,Journey to the Center of the Earth,Henry Levin,"Pat Boone, James Mason, Arlene Dahl, Diane Baker, Thayer David, Peter Ronson",United States,1959,G,45000000.0,101702060.0,93.0,88751.0,"Action,Science Fiction,Adventure,Comedy,Family,",Disney+
653,Jump In!,Paul Hoen,"Corbin Bleu, David Reivers, Shanica Knowles, Laivan Greene, Kylee Russell, Patrick Johnson Jr.",United States,2007,TV-G,0.0,0.0,85.0,13968.0,"Drama,Comedy,Romance,",Disney+
654,Jumping Ship,Michael Lange,"Joey Lawrence, Matthew Lawrence, Andrew Lawrence, Susan Walters, Stephen Burleigh, Anthony Wong","Australia, United States",2001,TV-G,0.0,0.0,92.0,68027.0,"TV Movie,Family,Drama,Comedy,",Disney+
655,Jungle 2 Jungle,John Pasquin,"Tim Allen, Martin Short, Lolita Davidovich, David Stiers, JoBeth Williams, Sam Huntington","United States, France",1997,PG,32000000.0,59927618.0,97.0,9446.0,"Comedy,Family,",Disney+
656,Jungle Cat,James Algar,Winston Hibler,United States,1960,TV-PG,0.0,0.0,69.0,179188.0,"Documentary,Family,",Disney+
657,Kazaam,Paul Glaser,"Shaquille O'Neal, Francis Capra, Ally Walker, James Acheson, John Costelloe, Marshall Manesh",United States,1996,PG,20000000.0,18937262.0,93.0,11511.0,"Fantasy,Comedy,Family,",Disney+
658,Kim Possible,"Adam Stein, Zach Lipovsky","Sadie Stanley, Sean Giambrone, Ciara Wilson, Taylor Ortega, Connie Ray, Issac Brown",United States,2019,TV-G,0.0,0.0,86.0,520720.0,"Family,Action,Adventure,Comedy,TV Movie,",Disney+
659,Kim Possible Movie: So the Drama,Steve Loter,"Christy Romano, Will Friedle, Nancy Cartwright, Tahj Mowry, Raven , Gary Cole",United States,2005,TV-G,,,,,,Disney+
660,Kingdom of the Apes: Battle Lines,,Dan Nachtrab,,2017,TV-PG,0.0,0.0,44.0,649160.0,"Documentary,",Disney+
661,Kingdom of the Blue Whale,,Tom Selleck,United States,2009,TV-PG,0.0,0.0,96.0,22109.0,"Documentary,TV Movie,",Disney+
662,Kitbull,Rosana Sullivan,,United States,2019,PG,0.0,0.0,9.0,574074.0,"Animation,Family,Drama,",Disney+
663,Knick Knack Theatrical Short,John Lasseter,,,2003,G,,,,,,Disney+
664,Kronk's New Groove,"Elliot Bour, Saul Blinkoff","Patrick Warburton, Tracey Ullman, Eartha Kitt, David Spade, John Goodman, Wendie Malick",United States,2005,G,0.0,0.0,75.0,13417.0,"Animation,Comedy,Family,",Disney+
665,La Luna,Enrico Casarosa,"Tony Fucile, Krista Sheffler, Phil Sheridan",United States,2012,G,0.0,0.0,142.0,30636.0,"Drama,",Disney+
666,Lady and the Tramp,Charlie Bean,"Tessa Thompson, Justin Theroux, Sam Elliott, Ashley Jensen, Janelle Monáe, Kiersey Clemons",United States,2019,PG,4000000.0,36359037.0,76.0,10340.0,"Family,Animation,Romance,",Disney+
667,Lava,James Murphy,"Kuana Kahele, Napua Greig",United States,2015,G,0.0,0.0,7.0,286192.0,"Animation,Family,",Disney+
668,LEGO Star Wars: The New Yoda Chronicles - Clash of the Skywalkers,Michael Hegner,"Tom Kane, Anthony Daniels, Matt Sloan, Trevor Devall, Kirby Morrow, Sam Vincent",United States,2014,TV-Y7,,,,,,Disney+
669,LEGO Star Wars: The New Yoda Chronicles - Raid on Coruscant,Michael Hegner,"Tom Kane, Anthony Daniels, Matt Sloan, Trevor Devall, Kirby Morrow, Sam Vincent","Denmark, China",2014,TV-Y7,,,,,,Disney+
670,LEGO Star Wars: The New Yoda Chronicles – Duel of the Skywalkers,Michael Hegner,"Tom Kane, Anthony Daniels, Matt Sloan, Trevor Devall, Kirby Morrow, Sam Vincent",United States,2014,TV-Y7,,,,,,Disney+
671,LEGO Star Wars: The New Yoda Chronicles – Escape from the Jedi Temple,Michael Hegner,"Tom Kane, Anthony Daniels, Matt Sloan, Trevor Devall, Sam Vincent, Kelly Metzger",United States,2014,TV-Y7,,,,,,Disney+
672,LEGO Star Wars: The New Yoda Chronicles – Race for the Holocrons,Michael Hegner,"Tom Kane, Anthony Daniels, Matt Sloan, Trevor Devall, Brian Drummond, Michael Donovan",United States,2014,TV-Y7,,,,,,Disney+
673,Lemonade Mouth,Patricia Riggen,"Bridgit Mendler, Adam Hicks, Hayley Kiyoko, Naomi Scott, Blake Michael, Nick Roux",United States,2011,TV-G,0.0,0.0,106.0,65218.0,"Drama,Comedy,TV Movie,",Disney+
674,Lend a Paw,Clyde Geronimi,,United States,1941,TV-Y7,0.0,0.0,8.0,51024.0,"Family,Animation,",Disney+
675,Leroy & Stitch,"Roberts Gannaway, Tony Craig","Daveigh Chase, Chris Sanders, David Stiers, Kevin McDonald, Tia Carrere, Kevin Michael Richardson",United States,2006,G,0.0,0.0,73.0,21316.0,"Animation,Comedy,Family,",Disney+
676,Let it Shine,Paul Hoen,"Tyler Williams, Coco Jones, Trevor Jackson, Brandon Smith, Dawnn Lewis, Alex Désert",United States,2012,TV-G,0.0,0.0,101.0,114955.0,"Family,Music,TV Movie,",Disney+
677,Life is Ruff,Charles Haid,"Kyle Massey, Kay Panabaker, Mitchel Musso, Carter Jenkins, Mark Lawrence, Judith Moreland",United States,2005,TV-G,0.0,0.0,84.0,160155.0,"TV Movie,Comedy,Family,",Disney+
678,Life With Mikey,James Lapine,"Michael Fox, Nathan Lane, Cyndi Lauper, David Krumholtz, David Huddleston, Christina Vidal",United States,1993,PG,2000000.0,12440858.0,91.0,42580.0,"Comedy,Family,",Disney+
679,Life-Size 2,Steven Tsuchida,"Tyra Banks, Francia Raisa, Gavin Stenhouse, Hank Chen, Alison Fernandez, Shanica Knowles",United States,2018,TV-14,0.0,0.0,81.0,500284.0,"Family,Fantasy,",Disney+
680,Lifted,Gary Rydstrom,,United States,2006,G,0.0,0.0,5.0,13060.0,"Family,Animation,Science Fiction,",Disney+
681,Lilo & Stitch,"Christopher Sanders, Dean DeBlois","Daveigh Chase, Christopher Sanders, Tia Carrere, David Ogden Stiers, Kevin McDonald, Ving Rhames",United States,2002,TV-PG,80000000.0,273144151.0,85.0,11544.0,"Animation,Family,",Disney+
682,Lilo & Stitch 2: Stitch Has a Glitch,"Tony Leondis, Michael LaBash","Christopher Sanders, Dakota Fanning, Tia Carrere, David Stiers, Kevin McDonald, Kunewa Mook",United States,2005,PG,80000000.0,273144151.0,85.0,11544.0,"Animation,Family,",Disney+
683,Lonesome Ghosts,Burt Gillett,,United States,1937,TV-Y7,0.0,0.0,9.0,32428.0,"Animation,Comedy,",Disney+
684,Lou,Dave Mullins,,United States,2017,G,0.0,0.0,107.0,429473.0,"Action,Thriller,Drama,",Disney+
685,Luck of the Irish,Paul Hoen,"Paul Kiernan, Timothy Omundson, Ryan Merriman, Glenndon Chatman, Henry Gibson, Marita Geraghty",United States,2001,TV-G,0.0,0.0,86.0,46004.0,"Family,TV Movie,Comedy,Adventure,",Disney+
686,Luxo Jr.,,,United States,1986,G,0.0,0.0,2.0,13925.0,"Animation,Comedy,",Disney+
687,Magician Mickey,David Hand,"Pinto Colvig, Walt Disney, Clarence Nash",United States,1937,TV-PG,0.0,0.0,8.0,66997.0,"Animation,",Disney+
688,Mail Dog,Charles Nichols,,United States,1947,TV-G,0.0,0.0,7.0,130426.0,"Animation,",Disney+
689,Man Among Cheetahs,,Bob Poole,United States,2017,TV-PG,0.0,0.0,44.0,649162.0,"Documentary,",Disney+
690,Mars: Inside SpaceX,Julia Reagan,,United States,2018,TV-PG,0.0,0.0,46.0,562685.0,"History,TV Movie,Documentary,",Disney+
691,Marvel Rising: Secret Warriors,Alfred Gimeno,"Dee Baker, Chloe Bennet, Kathreen Khavari, Andrew Kishino, Meera Kumbhani, Kamil McFadden",United States,2018,TV-Y7-FV,0.0,0.0,80.0,491633.0,"Family,Animation,Action,Comedy,Science Fiction,TV Movie,Adventure,",Disney+
692,Marvel Studios: Assembling A Universe,,"Jeff McNeil, Meghan Leon, Jason Hillhouse, Robert Downey Jr., Clark Gregg, Jon Favreau",United States,2014,TV-PG,0.0,0.0,43.0,259910.0,"TV Movie,Documentary,",Disney+
693,Marvel Studios: Expanding the Universe,,,,2019,TV-PG,0.0,0.0,12.0,647375.0,"Documentary,",Disney+
694,Marvel Studios' Ant-Man,Peyton Reed,"Paul Rudd, Evangeline Lilly, Corey Stoll, Bobby Cannavale, Michael Peña, Tip Harris",United States,2015,PG-13,130000000.0,519311965.0,117.0,102899.0,"Science Fiction,Action,Adventure,",Disney+
695,Marvel Studios' Avengers: Age of Ultron,Joss Whedon,"Robert Downey Jr., Chris Hemsworth, Mark Ruffalo, Chris Evans, Scarlett Johansson, Jeremy Renner",United States,2015,PG-13,365000000.0,1405403694.0,141.0,99861.0,"Action,Adventure,Science Fiction,",Disney+
696,Marvel Studios' Avengers: Endgame,"Anthony Russo, Joe Russo","Robert Downey Jr., Chris Evans, Mark Ruffalo, Chris Hemsworth, Scarlett Johansson, Jeremy Renner",United States,2019,PG-13,356000000.0,2797800564.0,181.0,299534.0,"Adventure,Science Fiction,Action,",Disney+
697,Marvel Studios' Captain America: Civil War,"Anthony Russo, Joe Russo","Chris Evans, Robert Downey Jr., Scarlett Johansson, Sebastian Stan, Anthony Mackie, Don Cheadle",United States,2016,PG-13,250000000.0,1153337496.0,147.0,271110.0,"Adventure,Action,Science Fiction,",Disney+
698,Marvel Studios' Captain America: The First Avenger,Joe Johnston,"Chris Evans, Tommy Jones, Hugo Weaving, Hayley Atwell, Sebastian Stan, Dominic Cooper",United States,2011,PG-13,140000000.0,370569774.0,124.0,1771.0,"Action,Adventure,Science Fiction,",Disney+
