,title,director,cast,country,release_year,rating,budget,revenue,runtime,movie_id,genre,streaming
244,Brave Little Tailor,Bill Roberts,"Walt Disney, Marcelite Garner, Eddie Holden",United States,1938,PG,0.0,0.0,9.0,57472.0,"Animation,Family,Fantasy,",Disney+
245,Lady and the Tramp II: Scamp's Adventure,Darrell Rooney,"Scott Wolf, Alyssa Milano, Chazz Palminteri, Jeff Bennett, Jodi Benson, Bill Fagerbakke","United States, Australia",2001,G,0.0,0.0,69.0,18269.0,"Family,Animation,Romance,Adventure,",Disney+
246,The Great Mouse Detective,"John Musker, Ron Clements, Dave Michener","Vincent Price, Barrie Ingham, Val Bettin, Susanne Pollatschek, Candy Candido, Diana Chesney",United States,1986,G,14000000.0,38625550.0,74.0,9994.0,"Animation,Family,Adventure,Mystery,",Disney+
247,The Sword in the Stone,Wolfgang Reitherman,"Sebastian Cabot, Karl Swenson, Rickie Sorensen, Junius Matthews, Ginny Tyler, Martha Wentworth",United States,1963,G,3000000.0,22182353.0,79.0,9078.0,"Animation,Family,",Disney+
248,Ice Age: Dawn Of The Dinosaurs,Carlos Saldanha,"Ray Romano, John Leguizamo, Denis Leary, Simon Pegg, Seann William Scott, Josh Peck","United States, United Kingdom, Australia",2009,PG,90000000.0,886686817.0,94.0,8355.0,"Animation,Comedy,Family,Adventure,",Disney+
249,Captain Sparky vs. The Flying Saucers,Mark Waring,Charlie Tahan,United States,2012,G,0.0,0.0,3.0,166659.0,"Animation,Family,",Disney+
250,InuYasha the Movie 2: The Castle Beyond the Looking Glass,Toshiya Shinohara,"Kappei Yamaguchi, Satsuki Yukino, Mieko Harada, Koji Tsujitani, Houko Kuwashima, Kumiko Watanabe, Noriko Hidaka, Kenichi Ogata, Toshiyuki Morikawa, Izumi Ogami",Japan,2002,PG-13,0.0,0.0,100.0,22537.0,"Action,Animation,Adventure,Fantasy,",Netflix
251,InuYasha the Movie 3: Swords of an Honorable Ruler,Toshiya Shinohara,"Kappei Yamaguchi, Satsuki Yukino, Koji Tsujitani, Houko Kuwashima, Kumiko Watanabe, Ken Narita, Akio Otsuka, Kikuko Inoue",Japan,2003,PG-13,0.0,0.0,99.0,34295.0,"Animation,Fantasy,Adventure,",Netflix
252,InuYasha the Movie 4: Fire on the Mystic Island,Toshiya Shinohara,"Kappei Yamaguchi, Satsuki Yukino, Koji Tsujitani, Houko Kuwashima, Kumiko Watanabe, Noriko Hidaka, Ken Narita, Cho, Mamiko Noto, Nobutoshi Canna",Japan,2004,PG,0.0,0.0,88.0,34297.0,"Fantasy,Animation,Adventure,",Netflix
253,InuYasha the Movie: Affections Touching Across Time,Toshiya Shinohara,"Kappei Yamaguchi, Satsuki Yukino, Koji Tsujitani, Houko Kuwashima, Kumiko Watanabe, Kenichi Ogata, Noriko Hidaka, Hisako Kyoda, Ken Narita, Tomokazu Seki",Japan,2001,PG,10540.0,0.0,99.0,42360.0,"Action,Animation,Adventure,Fantasy,",Netflix
254,Naruto Shippuden the Movie: Blood Prison,Masahiko Murata,"Junko Takeuchi, Chie Nakamura, Rikiya Koyama, Kazuhiko Inoue, Masaki Terasoma, Mie Sonozaki, Yuichi Nakamura, Kengo Kawanishi, Kosei Hirota, Masako Katsuki",Japan,2011,PG-13,0.0,0.0,108.0,75624.0,"Thriller,Animation,Action,Comedy,Horror,Mystery,",Netflix
255,Naruto Shippûden the Movie: Bonds,Hajime Kamegaki,"Junko Takeuchi, Chie Nakamura, Noriaki Sugiyama, Unsho Ishizuka, Motoko Kumai, Kazuhiko Inoue, Rikiya Koyama, Showtaro Morikubo, Nana Mizuki, Satoshi Hino, Shinji Kawada",Japan,2008,PG,0.0,0.0,90.0,17581.0,"Fantasy,Animation,Action,",Netflix
256,Naruto Shippûden the Movie: The Will of Fire,Masahiko Murata,"Junko Takeuchi, Chie Nakamura, Kazuhiko Inoue, Satoshi Hino, Showtaro Morikubo, Kentaro Ito, Ryoka Yuzuki, Kohsuke Toriumi, Nana Mizuki, Shinji Kawada, Yoichi Masukawa, Koichi Tochika, Yukari Tamura",Japan,2009,PG,0.0,8084148.0,95.0,36728.0,"Action,Adventure,Comedy,Drama,Fantasy,Animation,",Netflix
257,Naruto Shippuden: The Movie,Hajime Kamegaki,"Junko Takeuchi, Chie Nakamura, Yoichi Masukawa, Koichi Tochika, Ayumi Fujimura, Keisuke Oda, Daisuke Kishio, Fumiko Orikasa, Hidetoshi Nakamura, Tetsuya Kakihara, Kisho Taniyama, Miyuki Sawashiro, Katsuyuki Konishi, Masako Katsuki, Keiko Nemoto, Masashi Ebara, Kazuhiko Inoue, Showtaro Morikubo, Romi Park, Daisuke Ono, Seizo Kato",Japan,2007,PG,29000000.0,0.0,94.0,20982.0,"Animation,Action,Fantasy,",Netflix
258,Naruto Shippuden: The Movie: The Lost Tower,Masahiko Murata,"Junko Takeuchi, Chie Nakamura, Satoshi Hino, Rikiya Koyama, Nobuaki Fukuda, Kenji Hamada, Keiko Nemoto, Saori Hayami, Yumi Toma, Yuko Kobayashi, Fujiko Takimoto, Mutsumi Tamura, Mayuki Makiguchi, Toshiyuki Morikawa",Japan,2010,PG-13,0.0,0.0,85.0,50723.0,"Adventure,Action,Animation,",Netflix
259,Naruto the Movie 2: Legend of the Stone of Gelel,Hirotsugu Kawasaki,"Junko Takeuchi, Gamon Kaai, Chie Nakamura, Showtaro Morikubo, Akira Ishida, Yasuyuki Kase, Urara Takano, Sachiko Kojima, Houko Kuwashima, Takako Honda",Japan,2005,PG,0.0,0.0,96.0,16910.0,"Animation,Adventure,Fantasy,",Netflix
260,Naruto the Movie 3: Guardians of the Crescent Moon Kingdom,Toshiyuki Tsuru,"Junko Takeuchi, Chie Nakamura, Yoichi Masukawa, Kazuhiko Inoue, Akio Otsuka, Kyousuke Ikeda, Marika Hayashi, Umeji Sasaki, Masashi Sugawara, Hisao Egawa",Japan,2006,PG,25000000.0,0.0,95.0,18861.0,"Adventure,Animation,Action,",Netflix
261,Naruto the Movie: Ninja Clash in the Land of Snow,Tensai Okamura,"Junko Takeuchi, Noriaki Sugiyama, Chie Nakamura, Kazuhiko Inoue, Yuhko Kaida, Tsutomu Isobe, Hirotaka Suzuoki, Jun Karasawa, Harii Kaneko, Ikuo Nishikawa",Japan,2004,PG,0.0,0.0,82.0,16907.0,"Comedy,Action,Animation,Adventure,",Netflix
262,Open Season 2,"Matthew O'Callaghan, Todd Wilderman","Joel McHale, Mike Epps, Jane Krakowski, Billy Connolly, Crispin Glover, Steve Schirripa, Georgia Engel, Diedrich Bader, Cody Cameron, Fred Stoller, Olivia Hack","United States, Canada",2008,PG,0.0,8700000.0,76.0,13690.0,"Adventure,Animation,Comedy,Family,",Netflix
263,Osmosis Jones,"Bobby Farrelly, Peter Farrelly","Chris Rock, Laurence Fishburne, David Hyde Pierce, Brandy Norwood, William Shatner, Ron Howard, Kid Rock, Ben Stein",United States,2001,PG,75000000.0,13596911.0,95.0,12610.0,"Adventure,Animation,Action,Comedy,Family,",Netflix
264,Rhyme & Reason,Peter Spirer,"Too $hort, B-Real, Kurtis Blow, Da Brat, Grandmaster Caz, Sean ""P. Diddy"" Combs, Chuck D., Desiree Densiti, Dr. Dre, E-40, MC Eiht, Heavy D, Lauryn Hill, Ice-T, Wyclef Jean, Ras Kass, KRS-One, L.V., Mack 10, Craig Mack, Method Man, Keith Murray, Nasir 'Nas' Jones, The Notorious B.I.G., Master P, Q-Tip, Raekwon, Redman, Senen Reyes, Busta Rhymes, RZA, DJ Scratch, Erick Sermon, Tupac Shakur, Adario Strange, Suave",United States,1997,R,0.0,0.0,0.0,835739.0,"Animation,",Netflix
265,Monster Hunter: Legends of the Guild,Steven Yamamoto,"Ben Rausch, Erica Lindbeck, Dante Basco, Brando Eaton, Stephen Kramer Glickman, Caroline Caliston, G.K. Bowes, Dan McCoy","United States, Japan",2021,PG,0.0,0.0,58.0,851281.0,"Animation,Adventure,Action,Fantasy,",Netflix
266,Vivo,"Kirk DeMicco, Brandon Jeffords","Lin-Manuel Miranda, Ynairaly Simo, Zoe Saldana, Juan de Marcos, Brian Tyree Henry, Gloria Estefan, Michael Rooker, Nicole Byer","Canada, United States",2021,PG,0.0,0.0,103.0,449406.0,"Animation,Family,Comedy,",Netflix
267,Heavy,James Mangold,"Pruitt Taylor Vince, Shelley Winters, Liv Tyler, Debbie Harry, Evan Dando, Joe Grifasi, David Patrick Kelly, Marian Quinn",United States,1995,R,9300000.0,20100000.0,90.0,11827.0,"Animation,Science Fiction,Adventure,Fantasy,Music,",Netflix
268,Beowulf,Robert Zemeckis,"Ray Winstone, Anthony Hopkins, John Malkovich, Angelina Jolie, Robin Wright, Brendan Gleeson, Crispin Glover, Alison Lohman, Sharisse Baker-Bernard","United States, United Kingdom",2007,PG-13,70000000.0,195735876.0,115.0,2310.0,"Adventure,Action,Animation,",Netflix
269,Cloudy with a Chance of Meatballs,"Phil Lord, Christopher Miller","Bill Hader, Anna Faris, James Caan, Andy Samberg, Bruce Campbell, Mr. T, Bobb'e J. Thompson, Benjamin Bratt, Neil Patrick Harris, Al Roker","United States, Canada",2009,PG,78000000.0,248384621.0,95.0,109451.0,"Animation,Family,Comedy,",Netflix
270,Open Season: Scared Silly,David Feiss,"William Townsend, Donny Lucas, Melissa Sturm, Trevor Devall, Brian Drummond, Kathleen Barr, Garry Chalk, Lee Tockar, Shannon Chan-Kent, Michelle Murdocca, Lorne Cardinal, Peter Kelamis","United States, Canada",2015,PG,0.0,0.0,84.0,382517.0,"Animation,Comedy,Family,Adventure,",Netflix
271,Planet 51,Jorge Blanco,"Justin Long, Dwayne Johnson, Gary Oldman, Seann William Scott, Jessica Biel, John Cleese, Freddie Benedict","Spain, United Kingdom, United States",2009,PG,70000000.0,104945765.0,91.0,16866.0,"Animation,Family,Comedy,Science Fiction,Adventure,",Netflix
272,Chhota Bheem aur Krishna,Rajiv Chilaka,"Vatsal Dubey, Julie Tejwani, Rupa Bhimani, Jigna Bhardwaj, Rajesh Kava, Arun Shekher, Sanchit Wartak",India,2009,PG,0.0,0.0,69.0,614385.0,"Action,Adventure,Animation,Fantasy,",Netflix
273,Surf's Up,"Ash Brannon, Chris Buck","Shia LaBeouf, Jeff Bridges, Zooey Deschanel, Jon Heder, James Woods, Diedrich Bader, Mario Cantone, Kelly Slater, Rob Machado, Sal Masekela","United States, Canada",2007,PG,85000000.0,149044513.0,85.0,9408.0,"Animation,Comedy,Family,",Netflix
274,Ratchet and Clank,"Jericca Cleland, Kevin Munroe","Paul Giamatti, John Goodman, Bella Thorne, Rosario Dawson, Jim Ward, Armin Shimerman, Vincent Tong, Andrew Cownden, James Arnold Taylor, David Kaye, Sylvester Stallone","Hong Kong, Canada, United States",2016,PG,0.0,0.0,23.0,796272.0,"Animation,Adventure,Action,",Netflix
275,Kung Fu Panda,"John Stevenson, Mark Osborne","Jack Black, Dustin Hoffman, Angelina Jolie, Ian McShane, Seth Rogen, Lucy Liu, Jackie Chan, David Cross, Randall Duk Kim, James Hong","United States, China",2008,PG,130000000.0,631744560.0,90.0,9502.0,"Action,Adventure,Animation,Family,Comedy,",Netflix
276,Kung Fu Panda 2,Jennifer Yuh Nelson,"Jack Black, Angelina Jolie, Dustin Hoffman, Gary Oldman, Seth Rogen, Lucy Liu, Jackie Chan, David Cross, James Hong, Michelle Yeoh","United States, China",2011,PG,150000000.0,665692281.0,91.0,49444.0,"Animation,Family,",Netflix
277,America: The Motion Picture,Matt Thompson,"Channing Tatum, Jason Mantzoukas, Olivia Munn, Andy Samberg, Bobby Moynihan, Judy Greer, Will Forte, Raoul Trujillo, Killer Mike, Simon Pegg",United States,2021,R,0.0,0.0,98.0,739542.0,"Animation,Action,Comedy,",Netflix
278,Wish Dragon,Chris Appelhans,"Jimmy Wong, John Cho, Constance Wu, Will Yun Lee, Bobby Lee, Jimmy O. Yang, Ian Chen","China, United States, Canada",2021,PG,0.0,25860000.0,99.0,550205.0,"Animation,Family,Comedy,Fantasy,",Netflix
279,Jungle Beat: The Movie,Brent Dawes,"Ed Kear, David Menkin, Ina Marie Smith, John Guerrasio, David Rintoul, Gavin Peter, Lucy Montgomery, Florrie Wilkinson, Adam Neill, Jason Pennycooke",Mauritius,2021,PG,0.0,0.0,84.0,663459.0,"Family,Animation,Science Fiction,Comedy,",Netflix
280,Madagascar 3: Europe's Most Wanted,"Eric Darnell, Tom McGrath, Conrad Vernon","Ben Stiller, Chris Rock, David Schwimmer, Jada Pinkett Smith, Sacha Baron Cohen, Cedric the Entertainer, Andy Richter, Tom McGrath, Frances McDormand, Jessica Chastain, Bryan Cranston, Martin Short",United States,2012,PG,145000000.0,746921274.0,93.0,80321.0,"Animation,Family,Comedy,Adventure,",Netflix
281,The Yeti Adventures,"Pierre Greco, Nancy Florence Savard","Rachelle Lefevre, Noel Fisher, Colm Feore, Julian Stamboulieh, Jesse Camacho, Bronwen Mantel, Arthur Holden",Canada,2018,PG,0.0,0.0,84.0,490694.0,"Animation,Family,Adventure,",Netflix
282,Arlo the Alligator Boy,Ryan Crego,"Michael J. Woodard, Mary Lambert, Brett Gelman, Jonathan Van Ness, Tony Hale, Haley Tju, Annie Potts, Vincent Rodriguez III, Flea, Jennifer Coolidge",United States,2021,PG,0.0,0.0,92.0,763568.0,"Animation,Comedy,Family,",Netflix
283,Barbie & Chelsea: The Lost Birthday,Cassi Simonds,"America Young, Cassidy Naber, Kirsten Day, Cassandra Morris, Lisa Fuson, Greg Chun, Benjamin Pronsky, Laila Berzins, Nakia Burrise, Jacob Craner",United States,2021,G,0.0,0.0,64.0,1012801.0,"Animation,",Netflix
284,GANTZ:O,"Keiichi Sato, Yasushi Kawamura","Daisuke Ono, M・A・O, Tomohiro Kaku, Saori Hayami, Shuichi Ikeda, Kendo Kobayashi, Razor Ramon RG, Razor Ramon HG, Masane Tsukayama, Masaya Onosaka, Kenjiro Tsuda, Teruaki Ogawa, Hisanori Yoshida, Yuki Kaji",Japan,2016,R,0.0,2238600.0,95.0,396263.0,"Science Fiction,Action,Animation,",Netflix
285,New Gods: Nezha Reborn,Zhao Ji,"Yang Tianxiang, Zhang He, Xuan Xiaoming, Li Shimeng",China,2021,PG-13,0.0,0.0,116.0,663558.0,"Animation,Action,Fantasy,",Netflix
286,Escape from Planet Earth,Cal Brunker,"Rob Corddry, Brendan Fraser, Sarah Jessica Parker, William Shatner, Jessica Alba, Jane Lynch, George Lopez, Sofía Vergara, Craig Robinson, Ricky Gervais, Steve Zahn, Chris Parnell","United States, Canada",2013,PG,40000000.0,74597643.0,89.0,68179.0,"Animation,Comedy,Adventure,Family,Science Fiction,",Netflix
287,Woody Woodpecker,Alex Zamm,"Timothy Omundson, Thaila Ayala, Eric Bauza, Graham Verchere, Jordana Largy, Scott McNeil, Adrian Glynn McMorran, Chelsea Miller, Sean Tyson",United States,2017,PG,10000000.0,0.0,91.0,462883.0,"Comedy,Family,Animation,",Netflix
288,Kingsglaive: Final Fantasy XV,Takeshi Nozue,"Aaron Paul, Lena Headey, Sean Bean, Adrian Bouchet, Liam Mulvey, Alexa Kahn, Todd Haberkorn, John DeMita, David Gant, Darin De Paul","Japan, United States",2016,PG-13,0.0,269980.0,115.0,390734.0,"Animation,Science Fiction,Action,",Netflix
289,Starship Troopers: Traitor of Mars,"Shinji Aramaki, Masaru Matsumoto","Casper Van Dien, Dina Meyer, DeRay Davis, Justin Doran, Luci Christian, Emily Neves, Scott Gibbs, Juliet Simmons, Chris Gibson, Greg Ayres","United States, Japan",2017,R,0.0,0.0,87.0,460790.0,"Action,Animation,Science Fiction,",Netflix
290,The Knight and the Princess,Bashir El Deek,"Sedky Sakhr, Hashem El Garhy, Shahira Kamal, Aiemzy, Hani R. Eskander, Saif Abu-Kandil","Egypt, Saudi Arabia",2019,PG,3000000.0,0.0,95.0,636344.0,"Animation,Adventure,Family,Fantasy,",Netflix
291,Octonauts & the Ring of Fire,Blair Simmons,"Simon Greenall, Rob Rackstraw, Jo Wyatt, Paul Buckley, Simon Foster, Teresa Gallagher, Richard Grieve, Michael Murphy, Paul Panting, Keith Wickham","China, United Kingdom",2021,G,0.0,0.0,72.0,726940.0,"Family,Animation,",Netflix
292,Secret Magic Control Agency,Aleksey Tsitsilin,"Nicholas Corda, Sylvana Joyce, Alyson Leigh Rosenfeld, Courtney Shaw, Erica Schroeder, Georgette Timoney, Mary O'Brady, Marc Thompson","Russia, United States",2021,PG,0.0,0.0,104.0,797394.0,"Animation,Comedy,Fantasy,",Netflix
293,The Present,Farah Nabulsi,"Saleh Bakri, Maryam Kanj, Maryam Kamiel Basha, Ameer Khlawe, Ala' Hanani, Malak Abu Ghraibeh, Karam Elayyan, Leila Mouammar, Angie Saba","United Kingdom,",2020,R,0.0,0.0,4.0,379779.0,"Animation,Comedy,",Netflix
294,Bombay Rose,Gitanjali Rao,"Cyli Khare, Gargi Shitole, Amardeep Jha, Amit Deondi, Makrand Deshpande, Virendra Saxena, Shishir Sharma","India, United Kingdom, France, Qatar",2021,PG-13,0.0,0.0,93.0,587317.0,"Animation,Drama,Romance,",Netflix
295,Mariposa,Fajar Bustomi,"Adhisty Zara, Angga Yunanda, Dannia Salsabila, Abun Sungkar, Junior Roberts, Syakir Daulay, Ariyo Wahab, Ersa Mayori, Baim Wong, Irgi Fahrezi",Indonesia,2020,PG-13,0.0,0.0,75.0,18198.0,"Animation,Fantasy,Family,",Netflix
296,LEGO Marvel Spider-Man: Vexed by Venom,"Andrew Duncan, Ken Cunningham","Robbie Daymond, Ben Pronsky, Josh Keaton, Tara Strong, Jennifer Hale, Laura Bailey",United States,2019,G,0.0,0.0,21.0,622230.0,"Animation,Action,",Netflix
297,Bigfoot Family,"Jérémie Degruson, Ben Stassen","Jules Wojciechowski, Roger Craig Smith, Grant George, David Lodge, Lindsey Alena, Sandy Fox, Joey Lotsko","Belgium, France",2021,PG,17520000.0,10855626.0,97.0,702525.0,"Animation,Adventure,Family,",Netflix
298,Red,Tirumala Kishore,"Ram Pothineni, Nivetha Pethuraj, Malvika Sharma, Amritha Aiyer, Sampath Raj",India,2021,PG-13,190000000.0,18879922.0,100.0,508947.0,"Animation,Family,Comedy,Fantasy,",Netflix
299,Xico's Journey,Eric D. Cabello Díaz,"Verónica Alva, Pablo Gama Iturrarán “Mago Gamini”, Luis Ángel Jaramillo, Lila Downs, Elena Poniatowska, Verónica Castro, Enrique Guzmán, Alex Lora, Marco Antonio Solís, Víctor Trujillo",Mexico,2021,PG,0.0,0.0,85.0,749618.0,"Animation,Family,",Netflix
300,Pinkfong & Baby Shark's Space Adventure,Byeon Hee-sun,"Jo Kyoung-i, Kim Seo-yeong, Kim Eun-ah, Jeong Jae-heon","United States, South Korea",2019,G,0.0,0.0,66.0,649233.0,"Animation,Family,Music,",Netflix
301,Charming,Ross Venokur,"Wilmer Valderrama, Demi Lovato, Sia, Nia Vardalos, Ashley Tisdale, Avril Lavigne, G.E.M., John Cleese, Chris Harrison, Dee Bradley Baker, Carlos Alazraqui","Canada, United States, Cayman Islands",2021,PG,20000000.0,8751856.0,90.0,354279.0,"Animation,Adventure,Comedy,Family,Fantasy,Music,",Netflix
302,Cops and Robbers,"Arnon Manor, Timothy Ware-Hill",Timothy Ware-Hill,United States,2020,PG-13,0.0,0.0,8.0,776979.0,"Animation,",Netflix
303,Rango,Gore Verbinski,"Johnny Depp, Isla Fisher, Abigail Breslin, Ned Beatty, Alfred Molina, Bill Nighy, Stephen Root, Harry Dean Stanton, Timothy Olyphant, Ray Winstone","United States, Canada",2011,PG,135000000.0,245724603.0,107.0,44896.0,"Animation,Comedy,Family,Western,Adventure,",Netflix
304,The Magic School Bus Rides Again In the Zone,Richard Weston,"Mikaela Blake, Gabby Clarke, Roman Lutterotti, Leke Maceda-Rustecki, Matthew Mucci, Lynsey Pham, Kaden Stephen, Lights",Canada,2020,G,0.0,0.0,46.0,779796.0,"Family,Animation,",Netflix
305,Shaun the Sheep: The Farmer’s Llamas,Jay Grace,"Justin Fletcher, John Sparkes, Sean Connolly, Chris Grimes",United Kingdom,2020,G,0.0,0.0,30.0,374252.0,"TV Movie,Family,Animation,Comedy,",Netflix
306,Bobbleheads The Movie,Kirk Wise,"Jennifer Coolidge, Karen Fukuhara, Khary Payton, Julian Sands, Brenda Song, Luke Wilson, Cher",United States,2020,PG,0.0,0.0,82.0,754433.0,"Family,Animation,Adventure,Comedy,",Netflix
307,Spirit Riding Free: Ride Along Adventure,"Beth Sleven, Allan Jacobsen, Kevin Wotton","Amber Frank, Bailey Gambertoglio, Sydney Park, Katey Sagal, Rachel Kimsey, Darcy Rose Byrnes, Duncan Joiner, Bella Aboulhosn, Kai Scott",United States,2020,PG,0.0,0.0,22.0,773935.0,"Animation,",Netflix
308,Mighty Express: A Mighty Christmas,Clint Butler,"Jay Hatton, Zoe Hatz, Meesha Contreras, Dylan Schombing, Tyler Nathan, Leo Orgil, Michela Luci, Ian Ho, Evan Lefeuvre, Annick Obonsawin, Gracen Daly",Canada,2020,G,0.0,0.0,25.0,772732.0,"Animation,",Netflix
309,Captain Underpants Mega Blissmas,"Erik Kling, Kevin Peaty","Nat Faxon, Jay Gragnani, Ramone Hamilton, Sean Astin, Dayci Brookshire, Jim Cummings, Jorge Diaz",United States,2020,PG,0.0,0.0,45.0,768509.0,"Animation,Family,Comedy,",Netflix
310,Angela's Christmas Wish,Damien O’Connor,"Lucy O'Connell, Brendan Mullins, Ruth Negga, Lola Metcalfe, Jared Harris, Moe Dunford, Oscar Butler, Shona Hamill, Pat Kinevane, Janet Moran, Anya O'Connor",United States,2020,G,0.0,0.0,47.0,752455.0,"Animation,Family,",Netflix
311,Monster House,Gil Kenan,"Mitchel Musso, Sam Lerner, Spencer Locke, Steve Buscemi, Kathleen Turner, Jason Lee, Jon Heder, Maggie Gyllenhaal, Catherine O'Hara, Fred Willard, Nick Cannon, Kevin James",United States,2006,PG,75000000.0,140175006.0,91.0,9297.0,"Animation,Comedy,Family,Fantasy,",Netflix
312,Spookley and the Christmas Kittens,Bernie Denk,"Vlasta Vrana, Sonja Ball, Craig Francis, Richard C. Jones, Michael Perron, Terrence Scammell, Bruce Dinsmore, Jennifer Seguin, Daniel Brochu",United States,2019,G,0.0,0.0,44.0,653881.0,"Animation,Family,Music,Adventure,",Netflix
313,A Go! Go! Cory Carson Christmas,"Stanley Moore, Alex Woo","Alan C. Lim, Taron C. Hensley, Maisie Benson, Kerry Gudjohnsen, Paul Killam, Smith Foreman, Ann Kendrick, Ella Joy Ballesteros, Neena-Sinaii Simpo, Eli Morse",United States,2020,G,0.0,0.0,21.0,766534.0,"Animation,Family,",Netflix
314,Dragons: Rescue Riders: Huttsgalor Holiday,"Greg Rankin, TJ Sullivan","Noah Kaye Bentley, Brennley Brown, Zach Callison, Nicolas Cantu, Skai Jackson, Marsai Martin, Andre Robinson, Carlos Alazraqui, Roshon Fegan, Grey Griffin, Brad Grusnick, Sam Lavagnino, John C. McGinley, Roger Craig Smith",United States,2020,G,0.0,0.0,46.0,768076.0,"Animation,Family,",Netflix
315,Alien Xmas,Stephen Chiodo,"Keythe Farley, Dee Bradley Baker, Kaliayh Rhambo, Michelle Deco, Barbara Goodson",United States,2020,G,0.0,0.0,42.0,656561.0,"Animation,Family,Fantasy,",Netflix
316,Fukrey Boyzzz: Space Mein Fukrapanti,Avinash Walzade,"Viraaj Modgill, Jasleen Singh, Pooja Punjabi, Amit Deondi, Ketan Kava, Zeel Thakkar, Manish Bhavan, Viswanathan Sridhar",India,2020,PG,10000.0,10000.0,74.0,766900.0,"Animation,",Netflix
317,Elf Pets: A Fox Cub’s Christmas Tale,Chanda Bell,"Leslie Bellair, Brad Hyland, Brody Rose, Carol Aebersold",United States,2020,G,0.0,0.0,27.0,650809.0,"Animation,Family,Fantasy,",Netflix
318,Elf Pets: Santa’s Reindeer Rescue,Chanda Bell,"Brad Hyland, Drew Barber, Ashley Roberts, Lowrey Brown, Kristyl Tift, Manny Mahen, Olivia Berkeley, Eleanor Rocha",United States,2020,G,0.0,0.0,26.0,759633.0,"Animation,Family,",Netflix
319,Elliot the Littlest Reindeer,Jennifer Westcott,"Josh Hutcherson, Samantha Bee, Martin Short, Morena Baccarin, Jeff Dunham, John Cleese",Canada,2018,PG,0.0,0.0,89.0,455842.0,"Animation,Family,Adventure,",Netflix
320,Over the Moon,Glen Keane,"Cathy Ang, Phillipa Soo, Ken Jeong, Robert G. Chiu, John Cho, Sandra Oh, Ruthie Ann Miles, Margaret Cho, Kimiko Glenn, Artt Butler, Irene Tsu, Clem Cheung, Conrad Ricamora","China, United States",2020,PG,0.0,0.0,100.0,560050.0,"Animation,Adventure,Family,Fantasy,",Netflix
321,The Magic School Bus Rides Again The Frizz Connection,Richard Weston,"Kate McKinnon, Roman Lutterotti, Mikaela Blake, Gabby Clarke, Leke Maceda-Rustecki, Matthew Mucci, Birva Pandya, Lynsey Pham, Kaden Stephen",Canada,2020,G,0.0,0.0,44.0,754310.0,"Family,Animation,",Netflix
322,ParaNorman,"Sam Fell, Chris Butler","Kodi Smit-McPhee, Tucker Albrizzi, Anna Kendrick, Casey Affleck, Christopher Mintz-Plasse, Leslie Mann, Jeff Garlin, Elaine Stritch, Bernard Hill, Jodelle Ferland, Tempestt Bledsoe, Alex Borstein, John Goodman",United States,2012,PG,60000000.0,107139399.0,90.0,77174.0,"Family,Animation,Adventure,Comedy,",Netflix
323,Batman: The Killing Joke,Sam Liu,"Kevin Conroy, Mark Hamill, Tara Strong, Ray Wise, John DiMaggio, Robin Atkin Downes, Brian George, JP Karliak, Andrew Kishino, Nolan North",United States,2016,R,3500000.0,3775000.0,76.0,382322.0,"Action,Animation,Crime,Drama,",Netflix
324,StarBeam: Halloween Hero,Jon Izen,"Nahanni Mitchell, Dean Petriw, Terry Klassen, Sam Vincent, Rhona Rees, Laara Sadiq",Canada,2020,G,0.0,0.0,0.0,750794.0,"Animation,",Netflix
325,Welcome,Anees Bazmee,"Akshay Kumar, Katrina Kaif, Nana Patekar, Anil Kapoor, Paresh Rawal, Mallika Sherawat, Feroz Khan, Ruslaan Mumtaz, Sunil Shetty, Malaika Arora, Asrani",India,2007,PG,0.0,0.0,4.0,1015602.0,"Animation,Comedy,",Netflix
326,Horrid Henry's Gross Day Out,Gary Andrews,"Lizzie Waterworth-Santo, Emma Tate, Sue Elliot Nicholls, Tamsin Heatley, Wayne Forester, Aidan Cook, Philip Pope",United Kingdom,2020,G,0.0,0.0,61.0,743875.0,"Family,Animation,Adventure,",Netflix
327,The Smurfs 2,Raja Gosnell,"Neil Patrick Harris, Brendan Gleeson, Jayma Mays, Hank Azaria, Katy Perry, Christina Ricci, Jonathan Winters, J.B. Smoove, George Lopez, Anton Yelchin, Fred Armisen, Jacob Tremblay, Alan Cumming","United States, France, Canada, Belgium",2013,PG,105000000.0,347434178.0,105.0,77931.0,"Fantasy,Family,Comedy,Animation,",Netflix
328,How to Train Your Dragon 2,Dean DeBlois,"Jay Baruchel, Cate Blanchett, Gerard Butler, Craig Ferguson, America Ferrera, Jonah Hill, Christopher Mintz-Plasse, T.J. Miller, Kristen Wiig, Djimon Hounsou, Kit Harington",United States,2014,PG,145000000.0,621537500.0,102.0,82702.0,"Fantasy,Action,Adventure,Animation,Comedy,Family,",Netflix
329,Pets United,Reinhard Klooss,"Patrick Roche, Natalie Dormer, Eddie Marsan, Felix Auer, Jeff Burrell, Harvey Friedman, Marty Sander, Ian Odle, Bryan Larkin","Germany, China, United Kingdom",2020,PG,0.0,0.0,89.0,638134.0,"Animation,Family,Adventure,Comedy,",Netflix
330,Barbie Princess Adventure,Conrad Helten,"America Young, Erica Lindbeck, Ritesh Rajan, Dave Fennoy, Stephanie Sheh, Cristina Milizia, Desirae Whitfield, Emma Galvin, Angelo Restaino, Eamon Brennan, Ogie Banks",Netherlands,2020,G,0.0,0.0,72.0,738215.0,"Animation,Music,",Netflix
331,Children of the Sea,Ayumu Watanabe,"Mana Ashida, Hiiro Ishibashi, Seishu Uragami, Win Morisaki, Goro Inagaki, Yu Aoi, Toru Watanabe, Min Tanaka, Sumiko Fuji","Japan, United States",2019,PG,0.0,0.0,110.0,585077.0,"Animation,Fantasy,Adventure,Mystery,",Netflix
332,Fate/Grand Order -First Order-,Hitoshi Namba,"Nobunaga Shimazaki, Rie Takahashi, Ayako Kawasumi, Madoka Yonezawa, Kenichi Suzumura, Tomokazu Sugita",Japan,2016,PG-13,0.0,0.0,72.0,428142.0,"Action,Fantasy,Animation,",Netflix
333,Puss in Boots,Chris Miller,"Antonio Banderas, Salma Hayek, Zach Galifianakis, Billy Bob Thornton, Amy Sedaris, Constance Marie, Guillermo del Toro, Mike Mitchell",United States,2011,PG,0.0,0.0,104.0,315162.0,"Animation,Adventure,Comedy,Family,Fantasy,",Netflix
334,The Boss Baby: Get That Baby!,"Dan Forgione, Pete Jacobs, Matt Whitlock","JP Karliak, Pierce Gagnon, Alex Cazares, Kevin Michael Richardson, Flula Borg, Rhys Darby, Wendie Malick, Jake Green",United States,2020,PG,0.0,0.0,24.0,735364.0,"Comedy,Family,Animation,",Netflix
335,The Smurfs,Raja Gosnell,"Hank Azaria, Neil Patrick Harris, Jayma Mays, Sofía Vergara, Tim Gunn, Jonathan Winters, Katy Perry, Alan Cumming, Fred Armisen, George Lopez, Anton Yelchin, Kenan Thompson, Jeff Foxworthy, John Oliver, Wolfgang Puck, B.J. Novak, Paul Reubens","United States, Belgium, Canada, France",2011,PG,110000000.0,563749323.0,103.0,41513.0,"Animation,Family,Adventure,Comedy,Fantasy,",Netflix
336,True: Friendship Day,"Mark Thornton, Todd Kauffman","Michela Luci, Jamie Watson, Eric Peterson, Anna Claire Bartlam, Nicolas Aqui, Cory Doran, Julie Lemieux, Derek McGrath",Canada,2020,G,0.0,0.0,23.0,736517.0,"Animation,",Netflix
