,title,director,cast,country,release_year,rating,budget,revenue,runtime,movie_id,genre,streaming
433,Ghost Patrol,Karen J. Lloyd,"Scott McNeil, Vincent Tong, Travis Turner, Shannon Chan-Kent, Lili Beaudoin",Canada,2016,PG,0.0,0.0,50.0,422229.0,"Animation,Family,Mystery,",Netflix
434,Barbie Dolphin Magic,Conrad Helten,"Erica Lindbeck, Shannon Chan-Kent, Kazumi Evans, Claire Corlett, Ciana Swales, Adrian Petriw, Maryke Hendrikse, Paul Dobson, Garry Chalk","United States, Canada",2017,G,0.0,0.0,63.0,476631.0,"Animation,Adventure,Family,Fantasy,",Netflix
435,Berserk: The Golden Age Arc II - The Battle for Doldrey,Toshiyuki Kubooka,"Hiroaki Iwanaga, Takahiro Sakurai, Toa Yukinari, Yuki Kaji, Minako Kotobuki, Takahiro Fujiwara, Yoshiro Matsumoto, Kazuki Yao, Aki Toyosaki, Rikiya Koyama, Kenta Miyake, Nobuyuki Katsube, Houchu Ohtsuka, Takayuki Sugo",Japan,2012,R,0.0,0.0,98.0,118412.0,"Action,Adventure,Drama,Fantasy,Animation,",Netflix
436,Berserk: The Golden Age Arc III - The Advent,Toshiyuki Kubooka,"Hiroaki Iwanaga, Takahiro Sakurai, Toa Yukinari, Yuki Kaji, Yoshiro Matsumoto, Minako Kotobuki, Takahiro Fujiwara, Kazuki Yao, Yuichi Nakamura, Aki Toyosaki, Akio Otsuka",Japan,2013,R,0.0,0.0,110.0,144288.0,"Action,Adventure,Drama,Fantasy,Animation,",Netflix
437,The Guardian Brothers,Gary Wang,"Edward Norton, Dan Fogler, Mike Birbiglia, Bella Thorne, Randall Park, Mel Brooks, Nicole Kidman, Meryl Streep",China,2016,G,10000000.0,0.0,103.0,366644.0,"Animation,Family,Fantasy,",Netflix
438,Death Note,Adam Wingard,"Willem Dafoe, Nat Wolff, Lakeith Stanfield, Margaret Qualley, Shea Whigham, Paul Nakauchi, Jason Liles",United States,2017,R,0.0,0.0,130.0,51482.0,"TV Movie,Crime,Drama,Fantasy,Thriller,Animation,",Netflix
439,LEGO Marvel Super Heroes: Avengers Reassembled!,Rob Silvestri,"Laura Bailey, Troy Baker, Eric Bauza, Ben Diskin, Grant George, JP Karliak, Jim Meskimen, Bumper Robinson, Roger Craig Smith, Fred Tatasciore, Travis Willingham, Mick Wingert",United States,2015,PG,0.0,0.0,22.0,368304.0,"Family,Animation,",Netflix
440,Puss in Book: Trapped in an Epic Tale,"Roy Burdine, Johnny Castuciano","Eric Bauza, Jayma Mays, Maria Bamford, Jeff Bennett, Grey Griffin, Carla Jimenez, Paul Rugg, Joshua Rush",United States,2017,PG,0.0,0.0,23.0,462650.0,"Family,Fantasy,Animation,Comedy,Adventure,",Netflix
441,Slam,Andrea Molaioli,"Ludovico Tersigni, Jasmine Trinca, Luca Marinelli, Barbara Ramella, Gianluca Broccatelli, Pietro Ragusa, Fiorenza Tessari",Italy,2017,R,0.0,0.0,0.0,783675.0,"Animation,Comedy,Drama,",Netflix
442,LEGO: Marvel Super Heroes: Maximum Overload,Greg Richardson,"Troy Baker, Drake Bell, Fred Tatasciore, Dee Bradley Baker, Steve Blum, Adrian Pasdar, Greg Cipes, Chi McBride, Barry Dennen, Robin Atkin Downes",United States,2013,PG,0.0,0.0,22.0,763861.0,"Animation,Action,Comedy,",Netflix
443,Marvel's Hulk: Where Monsters Dwell,Mitch Schauer,"Fred Tatasciore, Liam O'Brien, Jesse Burch, Edward Bosco, Chiara Zanni, Mike Vaughn, Jon Olson, Matthew Waterson, Zach Callison, Laura Bailey, Hope Levy",United States,2016,PG,0.0,0.0,75.0,422153.0,"Action,Animation,Fantasy,Science Fiction,",Netflix
444,Bee Movie,"Steve Hickner, Simon J. Smith","Jerry Seinfeld, Renée Zellweger, Matthew Broderick, Patrick Warburton, John Goodman, Chris Rock, Kathy Bates, Barry Levinson, Larry King, Ray Liotta",United States,2007,PG,150000000.0,287594577.0,91.0,5559.0,"Family,Animation,Adventure,Comedy,",Netflix
445,A Grand Night In: The Story of Aardman,Richard Mears,Julie Walters,United Kingdom,2015,PG,0.0,0.0,59.0,374460.0,"Animation,Documentary,",Netflix
446,Berserk: The Golden Age Arc I - The Egg of the King,Toshiyuki Kubooka,"Hiroaki Iwanaga, Takahiro Sakurai, Toa Yukinari, Yuki Kaji, Minako Kotobuki, Takahiro Fujiwara, Yoshiro Matsumoto, Kazuki Yao, Aki Toyosaki, Rikiya Koyama, Kenta Miyake",Japan,2012,R,0.0,0.0,76.0,113082.0,"Action,Adventure,Fantasy,Animation,",Netflix
447,Bleach The Movie: Fade to Black,Noriyuki Abe,"Masakazu Morita, Fumiko Orikasa, Aya Hirano, Hiroshi Kamiya, Mitsuaki Madono, Ryotaro Okiayu, Kentaro Ito, Shinichiro Miki, Satsuki Yukino, Masaaki Tsukada",Japan,2008,PG,0.0,6032296.0,94.0,17165.0,"Action,Animation,Fantasy,Drama,",Netflix
448,Bleach the Movie: Hell Verse,Noriyuki Abe,"Masakazu Morita, Fumiko Orikasa, Kazuya Nakai, Noriaki Sugiyama, Kentarô Itô, Yuki Matsuoka, Ryotaro Okiayu, Romi Park",Japan,2010,PG-13,0.0,8749681.0,94.0,73245.0,"Action,Animation,Fantasy,Adventure,",Netflix
449,LEGO Jurassic World: The Indominus Escape,Michael D. Black,"A.J. LoCascio, Sendhil Ramamurthy, Fred Tatasciore, Jake Johnson, Lauren Lapkus, Zachary Levi, BD Wong, David Gunning",United States,2016,PG,0.0,0.0,24.0,419566.0,"Family,Animation,Comedy,",Netflix
450,My Little Pony Equestria Girls: Legend of Everfree,Ishi Rudell,"Tara Strong, Rebecca Shoichet, Ashleigh Ball, Andrea Libman, Tabitha St. Germain, Cathy Weseluck, Enid-Raye Adams, Brian Doe, Nicole Oliver","United States, Canada",2016,PG,0.0,0.0,73.0,405314.0,"Adventure,Animation,Music,Fantasy,Comedy,",Netflix
451,Kung Fu Panda: Secrets of the Scroll,Rodolphe Guenoden,"Jack Black, Dustin Hoffman, Seth Rogen, David Cross, Lucy Liu, Tara Macri, James Hong, Randall Duk Kim",United States,2016,PG,0.0,0.0,23.0,381693.0,"Animation,Family,Comedy,",Netflix
452,Marvel Super Hero Adventures: Frost Fight!,Mitch Schauer,"Mick Wingert, Matthew Mercer, Travis Willingham, Fred Tatasciore, Grey DeLisle, Troy Baker, Antony Del Rio, Trevor Devall, Kevin Michael Richardson, Steve Blum, Jane Singer",United States,2015,PG,0.0,0.0,73.0,372631.0,"Animation,Fantasy,",Netflix
453,Walt Disney Animation Studios Short Films Collection,"Chris Buck, Jennifer Lee, Patrick Osborne, Lauren MacMullan, John Kahrs, Nathan Greno, Byron Howard, Stevie Wermers, Dean Wellins, Kevin Deters, Roger Allers, Mike Gabriel, Mark Henn","Kristen Bell, Josh Gad, Jonathan Groff, Idina Menzel, Geoffrey Jones, Alfre Woodard, Carrie Harrington, Tim Hodge, David Murray, Sarah Chalke, Dave Foley, Derek Richardson, Betty White, Zachary Levi, Mandy Moore",United States,2015,G,0.0,0.0,85.0,348666.0,"Animation,Family,Comedy,Drama,Fantasy,",Netflix
454,Joseph: King of Dreams,"Rob LaDuca, Robert C. Ramirez","Ben Affleck, Mark Hamill, Richard Herd, Maureen McGovern, Jodi Benson, Judith Light, James Eckhouse, Richard McGonagle, David Campbell, Steven Weber, Dan Castellaneta, Rene Auberjonois, Ken Hudson Campbell, Tom Virtue, Jeff Bennett","United States, France, United Kingdom",2000,PG,0.0,0.0,75.0,16366.0,"Family,Animation,",Netflix
455,"10,000 B.C.",Roland Emmerich,"Steven Strait, Camilla Belle, Cliff Curtis, Joel Virgel, Affif Ben Badra, Mo Zinal, Nathanael Baring, Mona Hammond, Omar Sharif","United States, South Africa",2008,PG-13,0.0,0.0,10.0,106213.0,"Animation,",Netflix
456,Abominable Christmas,Chad Van De Keere,"Isabella Acres, Drake Bell, Emilio Estevez, Nolan Gould, Matthew Lillard, Ray Liotta, Jane Lynch, Ariel Winter",United States,2012,PG,0.0,0.0,44.0,150776.0,"Animation,Family,Comedy,Adventure,",Netflix
457,All Dogs Go to Heaven,"Don Bluth, Gary Goldman, Dan Kuenster","Dom DeLuise, Burt Reynolds, Daryl Gilley, Candy Devine, Charles Nelson Reilly, Vic Tayback, Melba Moore, Judith Barsi, Rob Fuller, Earleen Carey, Anna Manahan, Nigel Pegram, Loni Anderson, Ken Page, Godfrey Quigley","Ireland, United Kingdom, United States",1989,G,13800000.0,27100027.0,89.0,11497.0,"Drama,Animation,Family,Comedy,Fantasy,",Netflix
458,Alpha and Omega 2: A Howl-iday Adventure,Richard Rich,"Ben Diskin, Kate Higgins, Blackie Rose, Lindsay Torrance, Liza West, Tracy Pfau, Bill Lader, Meryl Leigh, Shaun Gerardo",United States,2013,G,0.0,0.0,45.0,227425.0,"Animation,Adventure,Comedy,",Netflix
459,Alpha and Omega: The Legend of the Saw Tooth Cave,Richard Rich,"Debi Derryberry, Ben Diskin, Kate Higgins, Lindsay Torrance, Larry Thomas, Bill Lader, Cindy Robinson","United States, India",2014,PG,0.0,0.0,53.0,294512.0,"Family,Animation,Comedy,Adventure,",Netflix
460,An American Tail,Don Bluth,"Erica Yohn, Nehemiah Persoff, Amy Green, Phillip Glasser, Christopher Plummer, John Finnegan, Will Ryan, Hal Smith, Dom DeLuise, Madeline Kahn",United States,1986,G,9000000.0,84542002.0,80.0,4978.0,"Drama,Family,Animation,Adventure,",Netflix
461,An American Tail: Fievel Goes West,"Phil Nibbelink, Simon Wells","Philip Glasser, James Stewart, Erica Yohn, Cathy Cavadini, Nehemiah Persoff, Dom DeLuise, Amy Irving, John Cleese, Jon Lovitz",United States,1991,G,0.0,40766041.0,75.0,10380.0,"Adventure,Animation,Family,Western,",Netflix
462,An American Tail: The Mystery of the Night Monster,Larry Latham,"Thomas Dekker, Lacey Chabert, Jane Singer, Nehemiah Persoff, Susan Boyd, Robert Hays, Pat Musick, Dom DeLuise, Candi Milo, Jeff Bennett",United States,1999,G,0.0,0.0,78.0,27653.0,"Adventure,Fantasy,Animation,Mystery,Family,",Netflix
463,April and the Extraordinary World,"Christian Desmares, Franck Ekinci","Angela Galuppo, Paul Giamatti, Susan Sarandon, Tony Hale, J.K. Simmons, Tony Robinow, Mark Camacho, Tod Fennell, Carlos Alazraqui, Kari Wahlgren","France, Canada, Belgium",2015,PG,10000000.0,0.0,103.0,340357.0,"Thriller,Adventure,Animation,Comedy,Fantasy,Science Fiction,",Netflix
464,Arthur,Jason Winer,"Russell Brand, Helen Mirren, Greta Gerwig, Jennifer Garner, Geraldine James, Luis Guzmán, Nick Nolte, Christina Jacquelyn Calph, Murphy Guyer, José Ramón Rosario",United States,2011,PG-13,10000000.0,0.0,97.0,51052.0,"Drama,Animation,Family,Comedy,",Netflix
465,Balto,Simon Wells,"Kevin Bacon, Bob Hoskins, Bridget Fonda, Jim Cummings, Phil Collins, Jack Angel, Danny Mann, Robbie Rist",United States,1995,G,31000000.0,11348324.0,78.0,21032.0,"Family,Animation,Adventure,",Netflix
466,Balto 2: Wolf Quest,Phil Weinstein,"Maurice LaMarche, Jodi Benson, Lacey Chabert, David Carradine, Mark Hamill, Charles Fleischer, Peter MacNicol, Rob Paulsen, Nicolette Little, Melanie Stone",United States,2001,G,0.0,0.0,75.0,25913.0,"Family,Animation,Adventure,",Netflix
467,Balto 3: Wings of Change,Phil Weinstein,"Maurice LaMarche, Sean Astin, Keith Carradine, Charles Fleischer, Jodi Benson, Bill Fagerbakke, Charity James, Kathy Najimy, David Paymer, Jean Smart",United States,2004,G,0.0,0.0,78.0,34942.0,"Family,Adventure,Animation,",Netflix
468,Barbie in A Mermaid Tale,Adam Wood,"Kelly Sheridan, Kathleen Barr, Tabitha St. Germain, Peter Mel, Nakia Burrise, Maryke Hendrikse, Emma Pierson, Ciara Janson, Garry Chalk, Nicole Oliver",United States,2010,G,0.0,16441438.0,75.0,34134.0,"Animation,Family,Fantasy,",Netflix
469,Barbie in Princess Power,Zeke Norton,"Kelly Sheridan, Britt Irvin, Michael Kopsa, Rebecca Husain, Kira Tozer",United States,2015,G,0.0,0.0,74.0,316322.0,"Animation,",Netflix
470,Barbie in Rock 'N Royals,Karen J. Lloyd,"Kelly Sheridan, Chiara Zanni, Bethany Brown, Devyn Dalton, Michael Dobson, Brynna Drummond, Rachel Harrison, Alessandro Juliani, Peter Kelamis, Omari Newton, Ingrid Nilson, Nicole Oliver, Shaun Smyth, Kira Tozer",United States,2015,G,0.0,0.0,84.0,355111.0,"Animation,Music,Family,",Netflix
471,Barbie Star Light Adventure,"Andrew Tan, Michael Goguen","Erica Lindbeck, Robbie Daymond, Kimberly Woods, Sarah Anne Williams, Michael Chandler, Dwight Schultz, Ben Bledsoe, Jonathan Lipow, Lucien Dodge, Laura Post",United States,2016,G,0.0,0.0,79.0,415749.0,"Animation,Family,Science Fiction,",Netflix
472,Barbie: A Fairy Secret,William Lau,"Diana Kaarina, Adrian Petriw, Britt Irvin, Cassandra Morris, Kate Higgins, Silvio Pollio, Brittney Wilson, Alexandra Carter, Nicole Oliver, Barbara Tyson",United States,2010,PG,0.0,0.0,72.0,57737.0,"Animation,Family,Fantasy,",Netflix
473,Barbie: Princess Charm School,Ezekiel Norton,"Diana Kaarina, Morwenna Banks, Nicole Oliver, Brittney Wilson, Ali Liebert, Shannon Chan-Kent, Madeleine Peters, Cathy Weseluck, Ellen Kennedy, Vincent Tong, Derek Waters, Brian Drummond, Tabitha St. Germain, Bethany Brown, Miranda Nolte, Kelly Metzger, Kazumi Evans, Anna Cummer","United States, Canada",2011,G,0.0,0.0,79.0,73456.0,"Family,Animation,Fantasy,",Netflix
474,Barbie: Spy Squad,Conrad Helten,"Erica Lindbeck, Stephanie Sheh, Jenny Pellicer, Alyssya Swales, Elizabeth Irving, Brian Dobson, Rebecca Husain, Cathy Weseluck","United States, Canada",2016,G,0.0,0.0,75.0,377897.0,"Action,Animation,Family,",Netflix
475,Barbie: The Princess & the Popstar,Ezekiel Norton,"Kelly Sheridan, Jennifer Waris, Ashleigh Ball, Tiffany Kathryn, Ellie King, Peter Kelamis, Jonathan Holmes, Allison Warnyca, Christopher Gaze, Lauren Lavoie",United States,2012,G,0.0,0.0,86.0,129533.0,"Family,Animation,",Netflix
476,Barbie: Video Game Hero,"Conrad Helten, Ezekiel Norton, Michael Goguen","Erica Lindbeck, Sienna Bohn, Shannon Chan-Kent, Michael Dobson, Alyssya Swales, Rebekah Asselstine, Brad Swaile, Sam Vincent, Ingrid Nilson, Nesta Cooper",United States,2017,G,0.0,0.0,72.0,434757.0,"Animation,Family,Science Fiction,",Netflix
477,Beavis and Butt-head Do America,Mike Judge,"Mike Judge, Bruce Willis, Demi Moore, Cloris Leachman, Robert Stack, Jacqueline Barba, Pamela Blair, Eric Bogosian, Kristofor Brown, Tony Darling, David Letterman",United States,1996,PG-13,12000000.0,63118386.0,80.0,3179.0,"Animation,Comedy,",Netflix
478,Bebe's Kids,Bruce W. Smith,"Faizon Love, Vanessa Bell Calloway, Wayne Collins, Jonell Green, Marques Houston, Tone-Loc, Myra J., Nell Carter",United States,1992,PG-13,0.0,8442162.0,72.0,36616.0,"Animation,Comedy,Family,",Netflix
479,Blinky Bill: The Movie,Deane Taylor,"Ryan Kwanten, Rufus Sewell, Toni Collette, Robin McLeavy, David Wenham, Barry Humphries, Richard Roxburgh, Deborah Mailman, Barry Otto","Australia, United States",2015,PG,12796917.0,0.0,93.0,339669.0,"Family,Animation,Adventure,",Netflix
480,Bob's Broken Sleigh,Jay Surridge,"Cole Howard, Bruce Greenwood, Victor Garber, Michael Adamthwaite, Raini Rodriguez, Colin Murdock, Maryke Hendrikse, Sam Vincent, Gabe Khouth",Canada,2015,G,0.0,0.0,46.0,372449.0,"Animation,",Netflix
481,Boy and the World,Alê Abreu,"Vinícius Garcia, Felipe Zilse, Alê Abreu, Lu Horta, Marco Aurélio Campos, Cassius Romero, Alfredo Rollo",Brazil,2013,PG,0.0,0.0,80.0,223706.0,"Animation,Adventure,Family,",Netflix
482,Bratz: The Movie,Sean McNamara,"Logan Browning, Janel Parrish, Nathalia Ramos, Skyler Shaye, Chelsea Kane",United States,2007,PG,0.0,0.0,64.0,35281.0,"Family,Animation,",Netflix
483,Chaar Sahibzaade,Harry Baweja,Om Puri,India,2014,PG,0.0,0.0,134.0,303457.0,"Action,Adventure,Animation,Documentary,Family,History,",Netflix
484,Chhota Bheem Kungfu Dhamaka,"Rajiv Chilaka, Binayak Das","Sonal Kaushal, Rupa Bhimani, Jigna Bharadhwaj, Sabina Malik, Julie Tejwani, Rajesh Kava, Vaibhav Thakkar, Samriddhi Shuklaa, Aditya Raj Sharma, Vinod Kulkarni",India,2019,PG,0.0,0.0,97.0,614256.0,"Animation,Adventure,Action,",Netflix
485,Coraline,Henry Selick,"Dakota Fanning, Teri Hatcher, John Hodgman, Jennifer Saunders, Dawn French, Keith David, Robert Bailey Jr., Ian McShane",United States,2009,PG,60000000.0,124600000.0,100.0,14836.0,"Animation,Family,Fantasy,",Netflix
486,Dear Dracula,Chad Van De Keere,"Nathan Gamble, Ray Liotta, Emilio Estevez, Ariel Winter, Matthew Lillard, Yuri Lowenthal, Marion Ross, Tara Strong",United States,2012,PG,0.0,0.0,43.0,140109.0,"Animation,Family,Comedy,",Netflix
487,Dr. Seuss' The Cat in the Hat,Bo Welch,"Mike Myers, Alec Baldwin, Kelly Preston, Dakota Fanning, Spencer Breslin, Amy Hill, Sean Hayes, Dan Castellaneta",United States,2003,PG,0.0,0.0,25.0,43580.0,"TV Movie,Animation,Family,",Netflix
488,Figaro Pho,Luke Jurevicius,Luke Jurevicius,United Kingdom,2008,PG,0.0,0.0,28.0,464127.0,"Animation,",Netflix
489,Ghost Pain,"Kazuchika Kise, Masahiko Murata","Maaya Sakamoto, Ikkyu Juku, Kenichirou Matsuda, Tarusuke Shingaki, Yoji Ueda, Miyuki Sawashiro, Mayumi Asano, Takanori Hoshino, Yasuhiro Mamiya, Kenji Nojima",Japan,2013,R,0.0,0.0,58.0,196750.0,"Action,Animation,Crime,Science Fiction,",Netflix
490,Ghost Tears,Kazuchika Kise,"Maaya Sakamoto, Ikkyu Juku, Kenichirou Matsuda, Tarusuke Shingaki, Shunsuke Sakuya, Takuro Nakakuni, Yoji Ueda, Kazuya Nakai, Miyuki Sawashiro, Tatsuhisa Suzuki",Japan,2014,R,0.0,0.0,59.0,240341.0,"Action,Animation,Science Fiction,",Netflix
491,Ghost Whispers,Kazuchika Kise,"Maaya Sakamoto, Ikkyu Juku, Kenichirou Matsuda, Tomoyuki Dan, Takuro Nakakuni, Yoji Ueda, Kazuya Nakai, Miyuki Sawashiro, Ikuya Sawaki, Takako Fuji",Japan,2013,PG-13,0.0,0.0,50.0,212168.0,"Action,Animation,Science Fiction,Thriller,",Netflix
492,HALO Legends,"Shinji Aramaki, Mamoru Oshii, Hideki Futamura, Toshiyuki Kanno, Tomoki Kyoda, Koichi Mashimo, Yasushi Muraki, Daisuke Nishio, Frank O'Connor, Koji Sawai, Joseph Chou, Hiroshi Yamazaki","Andy McAvin, James Faulkner, Luci Christian, John Swasey","United States, Japan",2009,PG-13,0.0,11000000.0,120.0,573531.0,"Animation,War,Drama,",Netflix
493,Hoodwinked Too! Hood vs. Evil,Mike Disa,"Hayden Panettiere, Glenn Close, Patrick Warburton, Joan Cusack, David Ogden Stiers, Bill Hader, Amy Poehler, Andy Dick, Martin Short, Brad Garrett, Cheech Marin, Tommy Chong, Heidi Klum, Wayne Newton",United States,2011,PG,30000000.0,13521829.0,86.0,57089.0,"Comedy,Animation,Family,",Netflix
494,Hotel Transylvania 3: Summer Vacation,Genndy Tartakovsky,"Adam Sandler, Selena Gomez, Kevin James, Kathryn Hahn, Andy Samberg, David Spade, Steve Buscemi, Fran Drescher, Molly Shannon, Mel Brooks, Keegan-Michael Key",United States,2018,PG,80000000.0,528600000.0,97.0,400155.0,"Animation,Comedy,Family,Fantasy,",Netflix
495,Hulk Vs.,"Sam Liu, Frank Paur","Fred Tatasciore, Matthew Wolf, Graham McTavish, Grey DeLisle, Kari Wahlgren, Bryce Johnson, Janyse Jaud, Jay Brazeau, Jonathan Holmes, Paul Dobson, Michael Adamthwaite, French Tickner, Nicole Oliver, Qayam Devji, Steve Blum, Mark Acheson, Colin Murdock, Nolan North, Tom Kane",United States,2009,PG-13,0.0,0.0,41.0,101907.0,"Action,Animation,Fantasy,Science Fiction,",Netflix
496,Igor,Tony Leondis,"John Cusack, Steve Buscemi, Sean Hayes, Molly Shannon, Eddie Izzard, Jennifer Coolidge, Jay Leno","United States, France",2008,PG,25000000.0,30700000.0,87.0,14248.0,"Animation,Comedy,Family,Fantasy,",Netflix
497,Jack and the Cuckoo-Clock Heart,"Mathias Malzieu, Stéphane Berla","Orlando Seale, Samantha Barks, Harry Sadeghi, Stephane Cornicard, Jessie Buckley, Sophia Ellis, Barbara Scaff, Michelle Fairley, Richard Ridings, Howard Samuels","France, Belgium",2013,PG,33746302.0,3445000.0,94.0,204436.0,"Animation,Romance,Adventure,Drama,Fantasy,",Netflix
498,Kahlil Gibran's The Prophet,"Roger Allers, Gaëtan Brizzi, Paul Brizzi, Joan C. Gratz, Mohammed Saeed Harib, Tomm Moore, Nina Paley, Bill Plympton, Joann Sfar, Michael Socha","Liam Neeson, Salma Hayek, John Krasinski, Frank Langella, Alfred Molina, John Rhys-Davies, Quvenzhané Wallis","United States, France, Canada, Lebanon, Qatar",2014,PG,0.0,0.0,85.0,283161.0,"Animation,",Netflix
499,Kung Fu Magoo,Andrés Couturier,"Dylan Sprouse, Cole Sprouse, Alyson Stoner, Tom Kenny, Chris Parnell, Rodger Bumpass, Maile Flanagan, Wally Wingert, Candi Milo, Jim Ward","Mexico, United States",2010,PG,0.0,0.0,79.0,71797.0,"Animation,Family,",Netflix
500,Kung Fu Panda: Holiday,Tim Johnson,"Jack Black, Angelina Jolie, Dustin Hoffman, Jackie Chan, Seth Rogen, Lucy Liu, David Cross, James Hong, Dan Fogler",United States,2010,PG,0.0,0.0,21.0,50393.0,"Animation,Family,TV Movie,Comedy,Fantasy,",Netflix
501,LeapFrog: Letter Factory,Roy Allen Smith,"Joey Camen, Marie Danielle, Mark Cacciatore, Dave Fennoy, Debi Derryberry",United States,2003,G,0.0,0.0,35.0,20610.0,"Animation,Family,",Netflix
502,LeapFrog: Numberland,Ron Myrick,"Jeannie Elias, Kat Feller, Sandy Fox, Cindy Robinson, Richard Rosenblatt",United States,2011,G,0.0,0.0,36.0,85450.0,"Animation,Family,",Netflix
503,LeapFrog: Phonics Farm,Ron Myrick,"Jeannie Elias, Kat Feller, Sandy Fox, Cindy Robinson, Richard Rosenblatt",United States,2011,G,0.0,0.0,35.0,83006.0,"Family,Animation,",Netflix
504,Legend of the Guardians: The Owls of Ga'Hoole,Zack Snyder,"Helen Mirren, Geoffrey Rush, Jim Sturgess, Hugo Weaving, Emily Barclay, Abbie Cornish, Ryan Kwanten, Anthony LaPaglia, Miriam Margolyes, Sam Neill","United States, Australia",2010,PG,80000000.0,140073390.0,97.0,41216.0,"Animation,Adventure,Family,Fantasy,",Netflix
505,Leo the Lion,Mario Cambi,"Daniel Amerman, John Cygan, Matthew Mercer, Amanda Allan, Porter Hansen, Debi Derryberry, Mari Devon, Eileen Galindo, Cole Sand","United States, Italy",2013,PG,0.0,0.0,46.0,256285.0,"Animation,Adventure,Family,",Netflix
506,Magic Snowflake,Luc Vinciguerra,"Nathan Simony, Benoît Allemane, Vincent Grass, Jean-Claude Donda, Alexis Tomassian, Pascal Sellem, Evelyne Grandjean, Alice Révérend, Kylian Trouillard, Céline Melloul","France, Belgium",2013,G,10000000.0,78.0,82.0,305387.0,"Family,Animation,",Netflix
507,Mahabharat,Amaan Khan,"Amitabh Bachchan, Ajay Devgn, Vidya Balan, Shatrughan Sinha, Sunny Deol, Anil Kapoor, Manoj Bajpayee, Jackie Shroff, Anupam Kher, Deepti Naval",India,2013,PG-13,7000000.0,210000.0,119.0,503928.0,"Adventure,Animation,Action,History,Family,",Netflix
508,Mary and the Witch's Flower,Hiromasa Yonebayashi,"Ruby Barnhill, Kate Winslet, Jim Broadbent, Ewen Bremner, Lynda Baron, Louis Ashbourne Serkis, Morwenna Banks, Teresa Gallagher, Rasmus Hardiker",Japan,2017,PG,0.0,0.0,103.0,430447.0,"Fantasy,Adventure,Animation,",Netflix
509,Mater,Pablo D'Alo Abba,"Lautaro Perotti, Tamara Kiper, Inda Lavalle, Miriam Odorico, Araceli Dvoskin, Gonzalo Ruiz, Patricio Aranguren, Marina Bellati, Luciana Fuks, Martin Slipak",Argentina,2017,R,0.0,0.0,7.0,141528.0,"Animation,Family,",Netflix
510,Miss Hokusai,Keiichi Hara,"Anne Watanabe, Yutaka Matsushige, Gaku Hamada, Kengo Kora, Jun Miho, Shion Shimizu, Michitaka Tsutsui, Ethan Murray, Kevin T. Collins, Barbara Goodson, Cindy Robinson, Mike Pollock, Robbie Daymond, Marc Diraison, Richard Epcar, Erica Lindbeck",Japan,2015,PG-13,0.0,0.0,90.0,267970.0,"Animation,Drama,History,",Netflix
511,Monster Family,Holger Tappe,"Celia Imrie, Emily Watson, Catherine Tate, Jason Isaacs, Nick Frost, Jessica Brown Findlay","Germany, United Kingdom",2017,PG,0.0,0.0,103.0,823609.0,"Animation,Family,",Netflix
512,Monster High 13 Wishes,Steve Sacks,"Erin Fitzgerald, Missi Hale, Marcus Griffin, Celeste Henderson, Evan Smith, Cindy Robinson, Julie Maddalena, Cam Clarke, Jonquil Goode",United States,2013,PG,0.0,0.0,73.0,212470.0,"Family,Fantasy,Animation,",Netflix
513,"Monster High: Boo York, Boo York",William Lau,"Karen Strassman, Celeste Henderson, Wendee Lee, TJ Smith, America Young, Rachel Staman, Laura Bailey",United States,2015,PG,0.0,0.0,72.0,360404.0,"Animation,Family,Music,",Netflix
514,Monster High: Escape from Skull Shores,"Steve Ball, Andrew Duncan","Kate Higgins, Debi Derryberry, Salli Saffioti, Evan Smith, Laura Bailey, Audu Paden, Erin Fitzgerald, Cindy Robinson, Ogie Banks, Cam Clarke",United States,2012,PG,0.0,0.0,45.0,167666.0,"Animation,Family,Fantasy,",Netflix
515,Monster High: Freaky Fusion,"William Lau, Sylvain Blais","Cam Clarke, Audu Paden, Laura Bailey, Cindy Robinson, Erin Fitzgerald, Kate Higgins, Salli Saffioti, Sue Swan, Haviland Stillwell, Paula Rhodes, America Young, Stephanie Sheh, Josey Montana McCoy",United States,2014,PG,0.0,0.0,73.0,290727.0,"Animation,",Netflix
516,Monster High: Friday Night Frights,Dustin McKenzie,"Laura Bailey, Ogie Banks, Cam Clarke, Debi Derryberry, Erin Fitzgerald, Kate Higgins, Julie Maddalena, Audu Paden, Cindy Robinson, Salli Saffioti, Evan Smith, America Young",United States,2013,PG,0.0,0.0,46.0,166747.0,"Animation,Family,",Netflix
517,Monster High: Fright On!,"Victor Dal Chele, Alfred Gimeno","Kate Higgins, Debi Derryberry, Salli Saffioti, Laura Bailey, Yuri Lowenthal, Audu Paden, Cindy Robinson, Erin Fitzgerald, America Young, Ogie Banks",United States,2011,PG,0.0,0.0,46.0,227257.0,"Family,Animation,Fantasy,",Netflix
518,"Monster High: Frights, Camera, Action!",William Lau,"Sue Swan, Kate Higgins, Celeste Henderson, Marcus Griffin, America Young, Karen Strassman, James Horan, Erin Fitzgerald, Laura Bailey, Yeni Alvarez",United States,2014,PG,0.0,0.0,72.0,260234.0,"Family,Animation,Fantasy,",Netflix
519,Monster High: Ghouls Rule,"Mike Fetterly, Steve Sacks","Laura Bailey, Hank Banks, Cam Clarke, Erin Fitzgerald, Dee Dee Green, Kate Higgins, Andrew Duncan",United States,2012,PG,0.0,0.0,70.0,134632.0,"Animation,Family,",Netflix
520,Monster High: Great Scarrier Reef,William Lau,"Larissa Galagher, Kate Higgins, Debi Derryberry, Salli Saffioti, America Young, Evan Smith, Lyndsy Kail, Rachel Staman, Cherami Leigh, Paula Rhodes, Erin Fitzgerald",United States,2016,PG,0.0,0.0,69.0,382581.0,"Family,Animation,",Netflix
521,Monster High: New Ghoul at School,"Audu Paden, Eric Radomski","Kate Higgins, Salli Saffioti, Debi Derryberry, Laura Bailey, Yuri Lowenthal, Audu Paden, Troy Baker, Erin Fitzgerald",United States,2010,PG,0.0,0.0,23.0,183443.0,"Family,Animation,Fantasy,",Netflix
522,"Monster High: Scaris, City of Frights","Dustin McKenzie, Andrew Duncan, Audu Paden","Laura Bailey, Cam Clarke, Erin Fitzgerald, Dee Dee Green, Celeste Henderson, Kate Higgins, Jonathan Lipow, Julie Maddalena, Dustin McKenzie, Audu Paden",United States,2013,G,0.0,0.0,61.0,192911.0,"Animation,Fantasy,",Netflix
523,Monster High: Why Do Ghouls Fall in Love?,"Dustin McKenzie, Steve Sacks","Laura Bailey, Ogie Banks, Cam Clarke, Debi Derryberry, Erin Fitzgerald, Kate Higgins, Jonathan Lipow, Audu Paden, Cindy Robinson, Salli Saffioti, Evan Smith, America Young",United States,2013,PG,0.0,0.0,45.0,167313.0,"Fantasy,Animation,",Netflix
524,Motu Patlu: King of Kings,Suhas Kadav,"Saurav Chakrabarty, Vinay Pathak",India,2016,PG,0.0,0.0,109.0,428227.0,"Animation,",Netflix
525,Mune: Guardian of the Moon,"Alexandre Heboyan, Benoît Philippon","Joshua J. Ballard, Nicole Provost, Trevor Devall, Michael Dobson, Jonathan Love, Davey Grant",France,2014,PG,17000000.0,15730665.0,86.0,323661.0,"Animation,Family,Adventure,Fantasy,",Netflix
